Job Zone,onet_code,Occupation,Data-level,url,Median Wage,Projected Growth,"Employment Change, 2024-2034",Projected Job Openings,Education,Top Education Level,Top Education Rate,Sample Job Titles,Job Description,altpath url,altpath simple title,total_tasks,aei_tasks,ai_task_coverage_pct,weighted_automation_pct,weighted_augmentation_pct,weighted_task_success_pct,weighted_ai_autonomy_mean,weighted_speedup_factor
4.0,17-2112.00,Industrial Engineers,Y,https://www.onetonline.org/link/summary/17-2112.00,"$48.63 hourly, $101,140 annual",Much faster than average (7% or higher),11.0,"25,200","59% Bachelor’s degree | 16% Some college, no degree",Bachelor's degree,59%,"Engineer, Engineering Manager, Industrial Engineer, Manufacturing Specialist, Operations Engineer, Plant Engineer, Process Engineer, Production Engineer, Supply Chain Engineer, Tool Engineer","Design, develop, test, and evaluate integrated systems for managing industrial production processes, including human work factors, quality control, inventory control, logistics and material flow, cost analysis, and production coordination.",https://altpath.org/discover/fm7d2b7uc1ugb6p22jahr9xk,Industrial Engineer,20.0,3.0,15.0,,,76.34883994605991,3.408761606489779,10.202652224012091
3.0,49-9041.00,Industrial Machinery Mechanics,Y,https://www.onetonline.org/link/summary/49-9041.00,"$30.65 hourly, $63,760 annual",Much faster than average (7% or higher),16.1,"45,700",47% Post-secondary certificate | 39% High school diploma or equivalent,Post-secondary certificate,47%,"Fixer, Industrial Machinery Mechanic, Industrial Mechanic, Loom Fixer, Machine Adjuster, Maintenance Mechanic, Maintenance Technician, Master Mechanic, Mechanic, Overhauler","Repair, install, adjust, or maintain industrial production and processing machinery or refinery and pipeline distribution systems.",https://altpath.org/discover/prwklhp568rlo0lel3wccx2j,Industrial Machinery Mechanic,16.0,2.0,12.5,37.59398496240601,10.526315789473683,72.7911756774757,3.637728379342416,9.125926126463352
4.0,11-3051.00,Industrial Production Managers,Y,https://www.onetonline.org/link/summary/11-3051.00,"$58.39 hourly, $121,440 annual",Slower than average (1% to 2%),1.9,"17,100",29% High school diploma or equivalent | 26% Bachelor’s degree,High school diploma or equivalent,29%,"Area Plant Manager, General Production Manager, Manufacturing Coordinator, Manufacturing Manager, Plant Manager, Plant Senior Manager, Product Line Manager, Production Control Manager, Production Manager, Sub Plant Manager","Plan, direct, or coordinate the work activities and resources necessary for manufacturing products in accordance with cost, quality, and quantity specifications.",https://altpath.org/discover/qftiga0v0paqrik47toyaubq,Industrial Production Manager,21.0,0.0,0.0,,,,,
2.0,53-7051.00,Industrial Truck and Tractor Operators,Y,https://www.onetonline.org/link/summary/53-7051.00,"$22.30 hourly, $46,390 annual",Slower than average (1% to 2%),1.1,"76,400",High school diploma,High school diploma,,"Checker Loader, Fork Lift Technician, Fork Truck Driver, Forklift Driver, Forklift Operator, Lift Truck Operator, Shag Truck Driver, Spotter Driver, Tow Motor Operator, Truck Driver","Operate industrial trucks or tractors equipped to move materials around a warehouse, storage yard, factory, construction site, or similar location.",https://altpath.org/discover/d31t5ulxhtolwro1ojtqes06,Tractor Operator,9.0,0.0,0.0,,,,,
5.0,19-3032.00,Industrial-Organizational Psychologists,Y,https://www.onetonline.org/link/summary/19-3032.00,"$52.81 hourly, $109,840 annual",Faster than average (5% to 6%),6.3,400,58% Master’s degree | 31% Doctoral degree,Master's degree,58%,"Assessment Services Manager, Consultant, Consulting Psychologist, Industrial Psychologist, Industrial/Organizational Psychologist (I/O Psychologist), Management Consultant, Organizational Consultant, Organizational Development Consultant, Organizational Psychologist, Research Scientist","Apply principles of psychology to human resources, administration, management, sales, and marketing problems. Activities may include policy planning; employee testing and selection, training and development; and organizational development and analysis. May work with management to organize the work setting to improve worker productivity.",https://altpath.org/discover/hb9kxk1u3p25su4cclkkrw2y,Organizational Psychologist,25.0,9.0,36.0,22.392838806645695,37.723592724460175,78.75282859795021,3.607035743736752,11.03311766258003
,55-3016.00,Infantry,,https://www.onetonline.org/link/summary/55-3016.00,,,,,,,,,"Operate weapons and equipment in ground combat operations. Duties include operating and maintaining weapons, such as rifles, machine guns, mortars, and hand grenades; locating, constructing, and camouflaging infantry positions and equipment; evaluating terrain and recording topographical information; operating and maintaining field communications equipment; assessing need for and directing supporting fire; placing explosives and performing minesweeping activities on land; and participating in basic reconnaissance operations.",,,,,,,,,,
,55-1016.00,Infantry Officers,,https://www.onetonline.org/link/summary/55-1016.00,,,,,,,,,"Direct, train, and lead infantry units in ground combat operations. Duties include directing deployment of infantry weapons, vehicles, and equipment; directing location, construction, and camouflage of infantry positions and equipment; managing field communications operations; coordinating with armor, artillery, and air support units; performing strategic and tactical planning, including battle plan development; and leading basic reconnaissance operations.",,,,,,,,,,
,43-4199.00,"Information and Record Clerks, All Other",,https://www.onetonline.org/link/summary/43-4199.00,"$23.25 hourly, $48,360 annual",Little or no change,-0.2,"17,800",,,,,All information and record clerks not listed separately.,https://altpath.org/discover/p941zbnhw945juferggx4pt1,Record Clerks,,,,,,,,
4.0,15-1212.00,Information Security Analysts,Y,https://www.onetonline.org/link/summary/15-1212.00,"$60.05 hourly, $124,910 annual",Much faster than average (7% or higher),28.5,"16,000",53% Bachelor’s degree | 23% Post-baccalaureate certificate,Bachelor's degree,53%,"Information Security Officer, Information Security Specialist, Information Systems Security Analyst, Information Systems Security Officer (ISSO), Information Technology Security Analyst (IT Security Analyst), Network Security Analyst, Security Analyst, Systems Analyst","Plan, implement, upgrade, or monitor security measures for the protection of computer networks and information. Assess system vulnerabilities for security risks and propose and implement risk mitigation strategies. May ensure appropriate security controls are in place that will safeguard digital files and vital electronic infrastructure. May respond to computer security breaches and viruses.",https://altpath.org/discover/kusikyl9ow21dt0ywqjsuog0,Information Security Analyst,11.0,8.0,72.7,31.25982703740333,43.70837959241599,69.42083451371383,3.477262182427537,12.15114163698216
4.0,15-1299.05,Information Security Engineers,Y,https://www.onetonline.org/link/summary/15-1299.05,"$52.39 hourly, $108,970 annual",Much faster than average (7% or higher),,"31,300",47% Bachelor’s degree | 16% Post-secondary certificate,Bachelor's degree,47%,"BISO (Business Information Security Officer), Cloud Engineer, Engineer, Information Security Auditor, Information Security System Engineer, Infrastructure Security Engineer, Security Analyst, Security Data Scientist, Security Engineer, Systems Engineer","Develop and oversee the implementation of information security procedures and policies. Build, maintain and upgrade security technology, such as firewalls, for the safe use of computer networks and the transmission and retrieval of information. Design and implement appropriate security controls to identify vulnerabilities and protect digital files and electronic infrastructures. Monitor and respond to computer security breaches, viruses, and intrusions, and perform forensic investigation. May oversee the assessment of information security systems.",https://altpath.org/discover/zj359w49dpxv358jcx4lz2xn,Information Security Engineer,20.0,0.0,0.0,,,,,
4.0,15-1299.09,Information Technology Project Managers,Y,https://www.onetonline.org/link/summary/15-1299.09,"$52.39 hourly, $108,970 annual",Much faster than average (7% or higher),,"31,300",38% Bachelor’s degree | 24% Associate’s degree,Bachelor's degree,38%,"Cloud Product Director, Cybersecurity Project Manager, Data Center Product Director, Information Systems Project Manager (IS Project Manager), IT Manager (Information Technology Manager), IT Program Manager (Information Technology Program Manager), IT Project Manager (Information Technology Project Manager), Scrum Master, Transition Program Manager","Plan, initiate, and manage information technology (IT) projects. Lead and guide the work of technical staff. Serve as liaison between business and technical aspects of projects. Plan project stages and assess business implications for each stage. Monitor progress to assure deadlines, standards, and cost targets are met.",https://altpath.org/discover/hvs43udoprcx3vvfld6da406,Information Technology Project Manager,21.0,6.0,28.6,34.70942565683089,,59.87874481055611,3.3689478040798657,18.38327952476469
2.0,51-9061.00,"Inspectors, Testers, Sorters, Samplers, and Weighers",Y,https://www.onetonline.org/link/summary/51-9061.00,"$22.82 hourly, $47,460 annual",Little or no change,0.0,"69,900",70% High school diploma or equivalent | 27% Post-secondary certificate,High school diploma or equivalent,70%,"Inspector, Picker / Packer, Quality Assurance Auditor, Quality Assurance Inspector, Quality Assurance Technician, Quality Auditor, Quality Control Inspector, Quality Control Technician, Quality Inspector, Quality Technician","Inspect, test, sort, sample, or weigh nonagricultural raw materials or processed, machined, fabricated, or assembled parts or products for defects, wear, and deviations from specifications. May use precision measuring instruments and complex test equipment.",https://altpath.org/discover/osjpw4o2557situk9gb6zdoy,Materials Inspector,31.0,2.0,6.5,44.166666666666664,34.544669041032385,71.75936608924873,3.117953961934014,9.502615632407547
,49-9099.00,"Installation, Maintenance, and Repair Workers, All Other",,https://www.onetonline.org/link/summary/49-9099.00,"$23.39 hourly, $48,640 annual",Slower than average (1% to 2%),2.4,"21,500",,,,,"All installation, maintenance, and repair workers not listed separately.",https://altpath.org/discover/knpaz2sno83v4vy5ct9qrpmt,Installation and Maintenance Workers,,,,,,,,
5.0,25-9031.00,Instructional Coordinators,Y,https://www.onetonline.org/link/summary/25-9031.00,"$35.92 hourly, $74,720 annual",Slower than average (1% to 2%),1.3,"21,900",60% Master’s degree | 25% Bachelor’s degree,Master's degree,60%,"Curriculum and Assessment Director, Curriculum and Instruction Director, Curriculum Coordinator, Curriculum Director, Curriculum Specialist, Education Specialist, Instructional Coach, Instructional Systems Specialist, Program Administrator, School Standards Coach","Develop instructional material, coordinate educational content, and incorporate current technology in specialized fields that provide guidelines to educators and instructors for developing curricula and conducting courses. Includes educational consultants and specialists, and instructional material directors.",https://altpath.org/discover/st6nppnxyctydm7qt6y1a90u,Instructional Coordinator,30.0,18.0,60.0,38.812389035291154,26.05922902374069,67.79095398914728,3.433404581122444,14.901684922212352
2.0,47-2131.00,"Insulation Workers, Floor, Ceiling, and Wall",Y,https://www.onetonline.org/link/summary/47-2131.00,"$23.41 hourly, $48,680 annual",Average (3% to 4%),3.8,"3,400",68% High school diploma or equivalent | 29% Less than high school diploma,High school diploma or equivalent,68%,"Attic Blower, Installer, Insulation Estimator, Insulation Installer, Insulation Mechanic, Insulation Worker, Insulator, Retrofit Installer, Spray Foam Installer, Warehouse Insulation Worker","Line and cover structures with insulating materials. May work with batt, roll, or blown insulation materials.",https://altpath.org/discover/gopeodoyya1aw7njfv8tkoli,Wall & Ceiling Insulation Worker,10.0,0.0,0.0,,,,,
2.0,47-2132.00,"Insulation Workers, Mechanical",Y,https://www.onetonline.org/link/summary/47-2132.00,"$27.52 hourly, $57,250 annual",Faster than average (5% to 6%),4.7,"2,300",72% High school diploma or equivalent | 21% Post-secondary certificate,High school diploma or equivalent,72%,"Commercial Insulator, Heat and Frost Insulator, Industrial Insulator, Insulation Helper, Insulation Installer, Insulation Mechanic, Insulation Worker, Insulator, Mechanic Insulator, Mechanical Insulator","Apply insulating materials to pipes or ductwork, or other mechanical systems in order to help control and maintain temperature.",https://altpath.org/discover/o57u3jsf9obkmasblu78lxfc,Insulation Worker,9.0,1.0,11.1,,,61.53846153846154,2.923076868057251,9.050848492851882
3.0,13-1032.00,"Insurance Appraisers, Auto Damage",Y,https://www.onetonline.org/link/summary/13-1032.00,"$36.85 hourly, $76,650 annual",Decline (-1% or lower),-8.2,500,"31% Some college, no degree | 29% Post-secondary certificate","Some college, no degree",31%,"Appraiser, Automobile Appraiser (Auto Appraiser), Automobile Damage Appraiser (Auto Damage Appraiser), Damage Appraiser, Field Appraiser, Field Inspector, Insurance Appraiser, Material Damage Appraiser, Outside Physical Damage Appraiser, Physical Damage Appraiser",Appraise automobile or other vehicle damage to determine repair costs for insurance claim settlement. Prepare insurance forms to indicate repair cost or cost estimates and recommendations. May seek agreement with automotive repair shop on repair costs.,https://altpath.org/discover/g767vjtt1xdunsvmaomzesd2,Auto Insurance Appraiser,7.0,1.0,14.3,,,,3.200000047683716,5.3071430590688005
2.0,43-9041.00,Insurance Claims and Policy Processing Clerks,Y,https://www.onetonline.org/link/summary/43-9041.00,"$23.29 hourly, $48,450 annual",Decline (-1% or lower),-3.7,"20,300",55% High school diploma or equivalent | 21% Associate’s degree,High school diploma or equivalent,55%,"Claims Adjudicator, Claims Analyst, Claims Clerk, Claims Customer Service Representative (Claims CSR), Claims Processor, Claims Representative (Claims Rep), Claims Technician (Claims Tech), Insurance Analyst, Policy Analyst, Underwriting Assistant","Process new insurance policies, modifications to existing policies, and claims forms. Obtain information from policyholders to verify the accuracy and completeness of information on claims forms, applications and related documents, and company records. Update existing policies and company records to reflect changes requested by policyholders and insurance company representatives.",https://altpath.org/discover/n42yb4xdsatg04c54psfbfu1,Insurance Claims Clerk,25.0,4.0,16.0,33.74168755421571,34.90566037735849,74.353820476814,3.08583005694286,11.421403778691472
4.0,41-3021.00,Insurance Sales Agents,Y,https://www.onetonline.org/link/summary/41-3021.00,"$29.02 hourly, $60,370 annual",Average (3% to 4%),3.7,"47,000",Bachelor's degree,Bachelor's degree,,"Account Executive, Account Manager, Accounts Executive, Insurance Agent, Insurance Broker, Insurance Sales Agent, Sales Agent, Sales Associate, Sales Representative, Underwriting Sales Representative","Sell life, property, casualty, health, automotive, or other types of insurance. May refer clients to independent brokers, work as an independent broker, or be employed by an insurance company.",https://altpath.org/discover/e9m54pnk03ixp7t4pnc535cz,Insurance Sales Agent,19.0,9.0,47.4,32.171383022541555,38.27766930454285,70.48986414338634,3.2417740665774724,11.064364300867735
4.0,13-2053.00,Insurance Underwriters,Y,https://www.onetonline.org/link/summary/13-2053.00,"$38.40 hourly, $79,880 annual",Decline (-1% or lower),-2.6,"8,200",70% Bachelor’s degree | 10% High school diploma or equivalent,Bachelor's degree,70%,"Account Underwriter, Automobile and Property Underwriter, Commercial Lines Underwriter, Health Underwriter, Life Underwriter, Personal Lines Underwriter, Underwriter, Underwriting Consultant, Underwriting Director, Underwriting Manager",Review individual applications for insurance to evaluate degree of risk involved and determine acceptance of applications.,https://altpath.org/discover/x3m6fou6d4avykv8t85gfc78,Insurance Underwriter,7.0,1.0,14.3,44.71544715447154,,,3.747967481613159,2.19014179357282
4.0,33-3021.06,Intelligence Analysts,Y,https://www.onetonline.org/link/summary/33-3021.06,"$44.99 hourly, $93,580 annual",Decline (-1% or lower),,"7,800",65% Bachelor’s degree | 13% Master’s degree,Bachelor's degree,65%,"Crime Analyst, Criminal Intelligence Analyst, Criminal Intelligence Analyst Supervisor, Criminal Intelligence Specialist, Criminal Research Specialist, Detective and Intelligence Analyst, Intelligence Analyst, Intelligence Officer, Intelligence Research Specialist, Supervisor Intelligence Analyst","Gather, analyze, or evaluate information from a variety of sources, such as law enforcement databases, surveillance, intelligence networks or geographic information systems. Use intelligence data to anticipate and prevent organized crime activities, such as terrorism.",https://altpath.org/discover/cupjnurab0u365yw9o940hl7,Intelligence Analyst,21.0,5.0,23.8,44.872886511244864,36.65999349176846,58.333333333333336,3.3519403944366655,18.729903762558095
4.0,27-1025.00,Interior Designers,Y,https://www.onetonline.org/link/summary/27-1025.00,"$30.52 hourly, $63,490 annual",Average (3% to 4%),3.2,"7,800","84% Bachelor’s degree | 4% Some college, no degree",Bachelor's degree,84%,"Decorating Consultant, Design Manager, Designer, Interior Design Consultant, Interior Design Coordinator, Interior Design Director, Interior Design Principal, Interior Design Project Manager, Interior Designer, Showroom Executive Director","Plan, design, and furnish interiors of residential, commercial, or industrial buildings. Formulate design which is practical, aesthetic, and conducive to intended purposes, such as raising productivity, selling merchandise, or improving life style. May specialize in a particular field, style, or phase of interior design.",https://altpath.org/discover/dnrgajkhbo8p1i3h9o04grjb,Interior Designer,16.0,2.0,12.5,,,,3.434177725909074,12.560061186733968
4.0,27-3091.00,Interpreters and Translators,Y,https://www.onetonline.org/link/summary/27-3091.00,"$28.58 hourly, $59,440 annual",Slower than average (1% to 2%),1.7,"6,900",55% Bachelor’s degree | 28% Master’s degree,Bachelor's degree,55%,"Court Interpreter, Deaf Interpreter, Educational Interpreter, Interpreter, Medical Interpreter, Paraprofessional Interpreter, Sign Language Interpreter, Spanish Interpreter, Technical Translator, Translator","Interpret oral or sign language, or translate written text from one language into another.",https://altpath.org/discover/ft4olobh57xahniuyilbidv0,Translator,17.0,11.0,64.7,49.41280195412904,29.30284396082305,84.34709021262265,3.0893519526001767,9.479390337058362
3.0,43-4111.00,"Interviewers, Except Eligibility and Loan",Y,https://www.onetonline.org/link/summary/43-4111.00,"$21.07 hourly, $43,830 annual",Decline (-1% or lower),-11.6,"15,800",42% High school diploma or equivalent | 33% Associate’s degree,High school diploma or equivalent,42%,"Admissions Clerk, Admissions Representative, Admitting Clerk, Interviewer, Market Research Interviewer, Patient Services Representative, Registrar, Registration Clerk, Research Interviewer, Telephone Interviewer","Interview persons by telephone, mail, in person, or by other means for the purpose of completing forms, applications, or questionnaires. Ask specific questions, record answers, and assist persons with completing form. May sort, classify, and file forms.",https://altpath.org/discover/bioox2fay1y3bockmjdt5it4,Interviewer,16.0,5.0,31.2,37.80413514081018,41.911764705882355,44.28526920833191,2.7971297868103293,9.03839007058466
5.0,11-3031.03,Investment Fund Managers,Y,https://www.onetonline.org/link/summary/11-3031.03,"$77.74 hourly, $161,700 annual",Much faster than average (7% or higher),,"74,600",63% Master’s degree | 33% Bachelor’s degree,Master's degree,63%,"Fixed Income Portfolio Manager, Fixed Income Vice President (Fixed Income VP), Investment Analysis Vice President (Investment Analysis VP), Portfolio Manager","Plan, direct, or coordinate investment strategy or operations for a large pool of liquid assets supplied by institutional investors or individual investors.",https://altpath.org/discover/tyz3oluny3s880wl5vfcdmev,Investment Fund Manager,20.0,9.0,45.0,46.940196631541475,31.066217597420767,44.03900672201219,3.2360490812525544,21.06801599871655
3.0,37-2011.00,"Janitors and Cleaners, Except Maids and Housekeeping Cleaners",Y,https://www.onetonline.org/link/summary/37-2011.00,"$17.27 hourly, $35,930 annual",Slower than average (1% to 2%),2.0,"351,300",Associate's degree,Associate's degree,,"Building Custodian, Building Service Worker, Building Services Technician, Cleaner, Custodial Worker, Custodian, Floor Tech (Floor Technician), Heavy Duty Custodian, Institutional Custodian, Janitor","Keep buildings in clean and orderly condition. Perform heavy cleaning duties, such as cleaning floors, shampooing rugs, washing walls and glass, and removing rubbish. Duties may include tending furnace and boiler, performing routine maintenance activities, notifying management of need for repairs, and cleaning snow or debris from sidewalk.",https://altpath.org/discover/xm2q0myvbbqk7q801k247s68,Janitor,21.0,0.0,0.0,,,,,
3.0,51-9071.00,Jewelers and Precious Stone and Metal Workers,Y,https://www.onetonline.org/link/summary/51-9071.00,"$23.63 hourly, $49,140 annual",Decline (-1% or lower),-5.5,"4,000",25% High school diploma or equivalent | 21% Post-secondary certificate,High school diploma or equivalent,25%,"Appraiser, Artisan Jeweler, Bench Jeweler, Caster, Gemologist, Goldsmith, Jeweler, Polisher, Silversmith, Stone Setter","Design, fabricate, adjust, repair, or appraise jewelry, gold, silver, other precious metals, or gems. Includes diamond polishers and gem cutters, and persons who perform precision casting and modeling of molds, casting metal in molds, or setting precious and semi-precious stones for jewelry and related products.",https://altpath.org/discover/s72007upb6uyeyrw0fe8ufs3,Jeweler,30.0,1.0,3.3,,,85.71428571428571,3.7142856121063232,8.843537739345006
5.0,23-1023.00,"Judges, Magistrate Judges, and Magistrates",Y,https://www.onetonline.org/link/summary/23-1023.00,"$75.10 hourly, $156,210 annual",Average (3% to 4%),2.5,900,66% Doctoral degree | 23% Professional degree,Doctoral degree,66%,"Circuit Court Judge, Circuit Judge, County Judge, Court of Appeals Judge, District Court Judge, Judge, Justice of the Peace, Magistrate, Municipal Court Judge, Superior Court Judge","Arbitrate, advise, adjudicate, or administer justice in a court of law. May sentence defendant in criminal cases according to government statutes or sentencing guidelines. May determine liability of defendant in civil cases. May perform wedding ceremonies.",https://altpath.org/discover/v1yfhm6vlsx5k8ancb2ioaoa,Judge,21.0,4.0,19.0,59.875039700764496,28.57142857142857,66.41340688453347,3.112108138266355,13.21433459055333
5.0,23-1012.00,Judicial Law Clerks,Y,https://www.onetonline.org/link/summary/23-1012.00,"$29.04 hourly, $60,400 annual",Average (3% to 4%),2.5,"1,000",52% Doctoral degree,Doctoral degree,52%,"Appellate Law Clerk, Career Law Clerk, Child Support Officer, Clerk to Justice, Deputy Clerk, Federal Law Clerk, Judicial Assistant, Judicial Clerk, Judicial Law Clerk, Law Clerk",Assist judges in court or by conducting research or preparing legal documents.,https://altpath.org/discover/wh2m67s73u50knoo4spi1lv3,Law Clerk,18.0,4.0,22.2,44.45539352265196,35.70164394480955,66.88484113995675,2.9440828904316843,13.80549707925741
4.0,25-2012.00,"Kindergarten Teachers, Except Special Education",Y,https://www.onetonline.org/link/summary/25-2012.00,"$61,430 annual",Decline (-1% or lower),-1.6,"12,800",76% Bachelor’s degree | 14% Master’s degree,Bachelor's degree,76%,"Bilingual Kindergarten Teacher, Classroom Teacher, Educator, Instructor, Kinder Teacher, Kindergarten Classroom Teacher, Kindergarten Teacher, Teacher, Title One Kindergarten Teacher, Transitional Kindergarten Teacher","Teach elemental natural and social science, personal hygiene, music, art, and literature to kindergarten students. Promote physical, mental, and social development. May be required to hold State certification.",https://altpath.org/discover/fkj5lmqxlfxyhdtib37rhtp3,Kindergarten Teacher,37.0,15.0,40.5,44.52348578918614,37.627302825769696,85.76747554353847,3.5469895965949005,11.3299923946889
4.0,13-1075.00,Labor Relations Specialists,Y,https://www.onetonline.org/link/summary/13-1075.00,"$44.95 hourly, $93,500 annual",Little or no change,-0.1,"5,100","33% Bachelor’s degree | 10% Some college, no degree",Bachelor's degree,33%,"Business Agent, Business Representative, Field Operations Coordinator, Grievance Manager, Labor Relations Director, Labor Relations Specialist","Resolve disputes between workers and managers, negotiate collective bargaining agreements, or coordinate grievance procedures to handle employee complaints.",https://altpath.org/discover/lgjyc4r98b8k2hplpaipz65l,Labor Relations Specialist,28.0,4.0,14.3,40.909090909090914,,75.02855578612048,3.2814961129433606,12.306133905200936
