Job Zone,onet_code,Occupation,Data-level,url,Median Wage,Projected Growth,"Employment Change, 2024-2034",Projected Job Openings,Education,Top Education Level,Top Education Rate,Sample Job Titles,Job Description,altpath url,altpath simple title,total_tasks,aei_tasks,ai_task_coverage_pct,weighted_automation_pct,weighted_augmentation_pct,weighted_task_success_pct,weighted_ai_autonomy_mean,weighted_speedup_factor
2.0,41-9011.00,Demonstrators and Product Promoters,Y,https://www.onetonline.org/link/summary/41-9011.00,"$18.25 hourly, $37,960 annual",Little or no change,-0.1,"14,000",64% High school diploma or equivalent | 35% Less than high school diploma,High school diploma or equivalent,64%,"Brand Ambassador, Demo Specialist, Demonstrator, Event Specialist, Field Merchandiser, Food Demonstrator, In Store Demonstrator, Merchandiser, Product Ambassador, Product Demonstrator",Demonstrate merchandise and answer questions for the purpose of creating public interest in buying the product. May sell demonstrated merchandise.,https://altpath.org/discover/sq8mzd61uyafq08fm0i5iqnt,Product Promoter,21.0,6.0,28.6,51.56558028775227,21.264653760939044,54.10247991418011,3.1857599243032566,13.603025003934984
3.0,31-9091.00,Dental Assistants,Y,https://www.onetonline.org/link/summary/31-9091.00,"$22.74 hourly, $47,300 annual",Faster than average (5% to 6%),6.4,"52,900",46% Post-secondary certificate | 29% High school diploma or equivalent,Post-secondary certificate,46%,"Certified Dental Assistant (CDA), Certified Registered Dental Assistant, Dental Assistant (DA), Expanded Duty Dental Assistant (EDDA), Expanded Function Dental Assistant, Oral Surgery Assistant, Orthodontic Assistant (Ortho Assistant), Orthodontic Technician, Registered Dental Assistant (RDA), Surgical Dental Assistant","Assist dentist, set up equipment, prepare patient for treatment, and keep records.",https://altpath.org/discover/b5gh0030om6z7grmqdex9sqy,Dental Assistant,16.0,1.0,6.2,,,96.0,3.0,3.538007176135198
3.0,29-1292.00,Dental Hygienists,Y,https://www.onetonline.org/link/summary/29-1292.00,"$45.32 hourly, $94,260 annual",Much faster than average (7% or higher),7.0,"15,300",75% Associate’s degree | 13% Professional degree,Associate's degree,75%,"Dental Hygienist, Hygienist, Licensed Dental Hygienist, Pediatric Dental Hygienist, Registered Dental Hygienist (RDH)",Administer oral hygiene care to patients. Assess patient oral hygiene problems or needs and maintain health records. Advise patients on oral health maintenance and disease prevention. May provide advanced care such as providing fluoride treatment or administering topical anesthesia.,https://altpath.org/discover/haka9iwvndsuhjqf4rneracv,Dental Hygienist,16.0,1.0,6.2,42.608695652173914,27.82608695652174,71.30434782608695,3.408695697784424,15.172720499644278
2.0,51-9081.00,Dental Laboratory Technicians,Y,https://www.onetonline.org/link/summary/51-9081.00,"$23.23 hourly, $48,310 annual",Decline (-1% or lower),-4.7,"3,900",52% High school diploma or equivalent | 18% Post-secondary certificate,High school diploma or equivalent,52%,"Crown and Bridge Dental Lab Technician, Dental Ceramist, Dental Laboratory Technician (Dental Lab Technician), Dental Technician (Dental Tech), Denture Technician, Metal Finisher, Model and Dye Person, Orthodontic Laboratory Technician (Orthodontic Lab Technician), Porcelain Technician, Waxer",Construct and repair full or partial dentures or dental appliances.,https://altpath.org/discover/b09612l1z7kwqsfggw0j16zh,Dental Laboratory Technician,17.0,0.0,0.0,,,,,
,29-1029.00,"Dentists, All Other Specialists",,https://www.onetonline.org/link/summary/29-1029.00,"$108.54 hourly, $225,770 annual",Little or no change,0.3,200,,,,,All dentists not listed separately.,,,,,,,,,,
5.0,29-1021.00,"Dentists, General",Y,https://www.onetonline.org/link/summary/29-1021.00,"$83.07 hourly, $172,790 annual",Average (3% to 4%),4.1,"3,900","81% Doctoral degree | 7% Some college, no degree",Doctoral degree,81%,"Associate Dentist, Dental Surgery Doctor (DDS), Dentist, Dentist/Owner, Doctor of Dental Medicine (DMD), Doctor of Dental Surgery (DDS), Family Dentist, General Dentist, General Dentist/Owner, Pediatric Dentist","Examine, diagnose, and treat diseases, injuries, and malformations of teeth and gums. May treat diseases of nerve, pulp, and other dental tissues affecting oral hygiene and retention of teeth. May fit dental appliances or provide preventive care.",https://altpath.org/discover/tu7rquq8wka938nvrzvhzhth,Dentist,20.0,3.0,15.0,15.2,63.46666666666667,88.29227351787306,3.485055824410298,7.133203582626813
5.0,29-1213.00,Dermatologists,Y,https://www.onetonline.org/link/summary/29-1213.00,"$115.00+ hourly, $239,200+ annual",Faster than average (5% to 6%),6.4,400,56% Doctoral degree | 31% Post-doctoral training,Doctoral degree,56%,"Board Certified Dermatologist, Dermatologist MD (Dermatologist Medical Doctor), Dermatologist Physician, Dermatopathologist, Doctor, MD (Medical Doctor), Mohs Micrographic Surgeon, Mohs Surgeon, Pediatric Dermatologist, Practicing Dermatologist","Diagnose and treat diseases relating to the skin, hair, and nails. May perform both medical and dermatological surgery functions.",https://altpath.org/discover/xcjk6u4f9lnzdshhrzfpnuha,Dermatologist,18.0,2.0,11.1,86.95652173913044,,91.30434782608695,3.4937695854015836,5.538826082132948
1.0,47-5011.00,"Derrick Operators, Oil and Gas",Y,https://www.onetonline.org/link/summary/47-5011.00,"$30.16 hourly, $62,740 annual",Slower than average (1% to 2%),0.5,"1,000",69% Less than high school diploma | 23% High school diploma or equivalent,Less than high school diploma,69%,"Derrick Hand, Derrick Man, Derrick Operator, Derrick Worker, Floor Hand",Rig derrick equipment and operate pumps to circulate mud through drill hole.,https://altpath.org/discover/mnt7ydpxtr3yh9z25p49dkek,Oil & Gas Derrick Operator,15.0,0.0,0.0,,,,,
,27-1029.00,"Designers, All Other",,https://www.onetonline.org/link/summary/27-1029.00,"$31.84 hourly, $66,220 annual",Slower than average (1% to 2%),2.0,"2,200",,,,,All designers not listed separately.,https://altpath.org/discover/gqboy6excqlecx4fh094viz8,Designers,,,,,,,,
3.0,43-9031.00,Desktop Publishers,Y,https://www.onetonline.org/link/summary/43-9031.00,"$25.78 hourly, $53,620 annual",Decline (-1% or lower),-12.4,400,Associate's degree,Associate's degree,,"Advertising Associate, Art Director, Computer Typesetter, Creative Director, Desktop Publishing Specialist, Electronic Console Display Operator, Electronic Imager, Graphic Artist, Mac Operator, Production Manager",Format typescript and graphic elements using computer software to produce publication-ready material.,https://altpath.org/discover/hpmoszmbkna2najokvmlce6n,Desktop Publisher,18.0,7.0,38.9,52.67018789021906,,71.2619943935963,3.24362327547053,15.240963332690608
3.0,33-3021.00,Detectives and Criminal Investigators,Y,https://www.onetonline.org/link/summary/33-3021.00,"$44.99 hourly, $93,580 annual",Decline (-1% or lower),-0.7,"7,800",32% High school diploma or equivalent | 20% Post-secondary certificate,High school diploma or equivalent,32%,"Crime Scene Investigator (CSI), Criminal Investigator, Detective, Fugitive Detective, Fugitive Investigator, Investigator, Narcotics Detective, Narcotics Investigator, Police Detective, Special Agent","Conduct investigations related to suspected violations of Federal, State, or local laws to prevent or solve crimes.",https://altpath.org/discover/o3gm3tnax1pofxqun3kakg2n,Criminal Investigator,30.0,3.0,10.0,64.0,,61.963636436134784,3.2139342155930075,13.61867902150233
3.0,29-2032.00,Diagnostic Medical Sonographers,Y,https://www.onetonline.org/link/summary/29-2032.00,"$42.95 hourly, $89,340 annual",Much faster than average (7% or higher),13.0,"5,800",47% Associate’s degree | 19% Post-secondary certificate,Associate's degree,47%,"Cardiac Sonographer, Cardiac/Vascular Sonographer, Diagnostic Medical Sonographer, Medical Sonographer, Registered Diagnostic Medical Sonographer (RDMS), Sonographer, Staff Sonographer, Ultrasonographer, Ultrasound Technician (Ultrasound Tech), Ultrasound Technologist (Ultrasound Tech)",Produce ultrasonic recordings of internal organs for use by physicians.,https://altpath.org/discover/aplsy5ypt8h5z28v4vujspsk,Diagnostic Medical Sonographer,20.0,2.0,10.0,,,71.875,3.471246319466119,9.210725229704538
3.0,29-2051.00,Dietetic Technicians,Y,https://www.onetonline.org/link/summary/29-2051.00,"$17.81 hourly, $37,040 annual",Average (3% to 4%),2.5,"4,000",35% Associate’s degree | 27% Post-secondary certificate,Associate's degree,35%,"Certified Dietary Manager (CDM), Cook Chill Technician (CCT), Diet Assistant, Diet Clerk, Diet Tech (Diet Technician), Diet Tech (Dietetic Technician), Diet Technician Registered (DTR), Dietary Aid, Dietary Aide, Dietary Manager","Assist in the provision of food service and nutritional programs, under the supervision of a dietitian. May plan and produce meals based on established guidelines, teach principles of food and nutrition, or counsel individuals.",https://altpath.org/discover/eg6lsjh8cxmgouwjlqvebn8w,Dietetic Technician,13.0,3.0,23.1,43.84305117500322,14.34723625532666,75.87516421970983,3.3344750068246407,10.683329859269474
5.0,29-1031.00,Dietitians and Nutritionists,Y,https://www.onetonline.org/link/summary/29-1031.00,"$35.50 hourly, $73,850 annual",Faster than average (5% to 6%),5.5,"6,200",53% Post-baccalaureate certificate | 33% Master’s degree,Post-baccalaureate certificate,53%,"Clinical Dietician, Clinical Dietitian, Correctional Food Service Supervisor, Dietary Manager, Dietitian, Nutritionist, Outpatient Dietitian, Pediatric Clinical Dietician, Registered Dietician, Registered Dietitian","Plan and conduct food service or nutritional programs to assist in the promotion of health and control of disease. May supervise activities of a department providing quantity food services, counsel individuals, or conduct nutritional research.",https://altpath.org/discover/rtedk5pbu1wgy3n6zi71e21q,Nutritionist,28.0,5.0,17.9,32.03025457264807,57.96511397813146,80.06074098306772,3.463550336634353,13.858398495817031
4.0,15-1299.06,Digital Forensics Analysts,Y,https://www.onetonline.org/link/summary/15-1299.06,"$52.39 hourly, $108,970 annual",Much faster than average (7% or higher),,"31,300",Bachelor's degree,Bachelor's degree,,,"Conduct investigations on computer-based crimes establishing documentary or physical evidence, such as digital media and logs associated with cyber intrusion incidents. Analyze digital evidence and investigate computer security incidents to derive information in support of system and network vulnerability mitigation. Preserve and present computer-related evidence in support of criminal, fraud, counterintelligence, or law enforcement investigations.",https://altpath.org/discover/fe9m32why6sergz4fvw00v6u,Digital Forensics Analyst,20.0,0.0,0.0,,,,,
1.0,35-9011.00,Dining Room and Cafeteria Attendants and Bartender Helpers,Y,https://www.onetonline.org/link/summary/35-9011.00,"$15.71 hourly, $32,670 annual",Faster than average (5% to 6%),6.3,"99,600",74% High school diploma or equivalent | 22% Less than high school diploma,High school diploma or equivalent,74%,"Bar Back, Bus Boy, Bus Person, Busboy, Dietary Aid, Dietary Aide, Dining Room Attendant, Server, Server Assistant, Shift Manager","Facilitate food service. Clean tables, remove dirty dishes, replace soiled table linens; set tables; replenish supply of clean linens, silverware, glassware, and dishes; supply service bar with food; and serve items such as water, condiments, and coffee to patrons.",https://altpath.org/discover/umht1tou989z439z7esftx89,Helper--Food Service,23.0,0.0,0.0,,,,,
4.0,21-2021.00,"Directors, Religious Activities and Education",Y,https://www.onetonline.org/link/summary/21-2021.00,"$26.37 hourly, $54,840 annual",Slower than average (1% to 2%),2.1,"13,800",54% Bachelor’s degree | 21% Post-secondary certificate,Bachelor's degree,54%,"Adult Ministries Director, Children's Ministries Director, Christian Education Director, Religious Education Coordinator, Religious Education Director, Senior Adults Director, Student Ministries Director, Women's Ministry Director, Youth Director, Youth Ministry Director","Plan, direct, or coordinate programs designed to promote the religious education or activities of a denominational group. May provide counseling and guidance relative to marital, health, financial, and religious problems.",https://altpath.org/discover/uqf0n1mn3k9yktcg1mwtej6p,Religious Activities Director,19.0,6.0,31.6,39.21498294783214,38.359856782856056,74.0475726095612,3.4476253728757,11.973875730425748
2.0,27-2091.00,"Disc Jockeys, Except Radio",Y,https://www.onetonline.org/link/summary/27-2091.00,$20.59 hourly,Average (3% to 4%),3.8,"1,500",High school diploma,High school diploma,,,"Play prerecorded music for live audiences at venues or events such as clubs, parties, or wedding receptions. May use techniques such as mixing, cutting, or sampling to manipulate recordings. May also perform as emcee (master of ceremonies).",https://altpath.org/discover/z0ncsu4pow7kiqlb7u4wa9vu,Disc Jockey,19.0,0.0,0.0,,,,,
1.0,35-9021.00,Dishwashers,Y,https://www.onetonline.org/link/summary/35-9021.00,"$16.19 hourly, $33,670 annual",Little or no change,0.2,"76,800",56% High school diploma or equivalent | 43% Less than high school diploma,High school diploma or equivalent,56%,"Dietary Aide, Dish Machine Operator (DMO), Dish Room Worker, Dish Technician, Dish Washer, Dishwasher, Kitchen Helper, Kitchen Steward, Stewarding Supervisor, Utility Aide","Clean dishes, kitchen, food preparation equipment, or utensils.",https://altpath.org/discover/aqtf8r2ua09bi4pjuv3tc617,Dishwasher,13.0,0.0,0.0,,,,,
2.0,43-5032.00,"Dispatchers, Except Police, Fire, and Ambulance",Y,https://www.onetonline.org/link/summary/43-5032.00,"$23.50 hourly, $48,880 annual",Decline (-1% or lower),-0.9,"18,500","47% High school diploma or equivalent | 26% Some college, no degree",High school diploma or equivalent,47%,"Aircraft Dispatcher, City Dispatcher, Dispatch Manager, Dispatcher (Dispatch), Motor Coach Supervisor, Operations Dispatcher, Rail Operations Controller, School Bus Dispatcher, Train Dispatcher, Truck Dispatcher","Schedule and dispatch workers, work crews, equipment, or service vehicles for conveyance of materials, freight, or passengers, or for normal installation, service, or emergency repairs rendered outside the place of business. Duties may include using radio, telephone, or computer to transmit assignments and compiling statistics and reports on work progress.",https://altpath.org/discover/jkcnyocox0o5gu56v5luja2p,Dispatcher,12.0,2.0,16.7,,50.0,65.9090909090909,3.1339774257273874,7.985592351352363
4.0,15-1299.03,Document Management Specialists,Y,https://www.onetonline.org/link/summary/15-1299.03,"$52.39 hourly, $108,970 annual",Much faster than average (7% or higher),,"31,300",60% Bachelor’s degree | 15% Master’s degree,Bachelor's degree,60%,"Business Records Manager, Certified Document Imaging Architect, Document Control Manager, Document Management Consultant, ECM Consultant (Enterprise Content Management Consultant), Electronic Content Manager, Record Systems Analyst, Records and Information Management Consultant (RIM Consultant), Records and Information Management Specialist (RIM Specialist), Records Manager","Implement and administer enterprise-wide document management systems and related procedures that allow organizations to capture, store, retrieve, share, and destroy electronic records and documents.",https://altpath.org/discover/cbpi9lekind4b6aodxzokjzb,Document Management Specialist,23.0,9.0,39.1,40.25004992178084,29.171949908491396,52.808425280455744,3.161607827968816,16.533028482258544
1.0,41-9091.00,"Door-to-Door Sales Workers, News and Street Vendors, and Related Workers",Y,https://www.onetonline.org/link/summary/41-9091.00,"$16.60 hourly, $34,530 annual",Decline (-1% or lower),-10.0,"2,700",57% Less than high school diploma | 43% High school diploma or equivalent,Less than high school diploma,57%,"Demonstrator, Direct Sales Coach, Door-to-Door Sales Trainer, Independent Beauty Consultant, Independent Distributor, Independent Jeweler, Independent Sales Associate, Independent Sales Representative, Sales Representative, Street Vendor",Sell goods or services door-to-door or on the street.,https://altpath.org/discover/z8puj5r4jml3v14k9meccvxl,Street Vendor,12.0,4.0,33.3,38.40859536748093,39.00841746869658,47.30895059726612,3.189042160583434,11.63586507192572
,17-3019.00,"Drafters, All Other",,https://www.onetonline.org/link/summary/17-3019.00,"$29.81 hourly, $62,010 annual",Decline (-1% or lower),-6.9,"1,300",,,,,All drafters not listed separately.,https://altpath.org/discover/q7sstty6bp3pc3ho1z51fivd,Drafters,,,,,,,,
2.0,53-7031.00,Dredge Operators,Y,https://www.onetonline.org/link/summary/53-7031.00,"$23.28 hourly, $48,430 annual",Slower than average (1% to 2%),1.2,100,80% High school diploma or equivalent | 9% Post-secondary certificate,High school diploma or equivalent,80%,"Dredge Operator, Dredger","Operate dredge to remove sand, gravel, or other materials in order to excavate and maintain navigable channels in waterways.",https://altpath.org/discover/p6ctysxoaq4v02q03vw053x6,Dredge Operator,6.0,0.0,0.0,,,,,
2.0,51-4032.00,"Drilling and Boring Machine Tool Setters, Operators, and Tenders, Metal and Plastic",Y,https://www.onetonline.org/link/summary/51-4032.00,"$22.42 hourly, $46,630 annual",Decline (-1% or lower),-19.6,400,"57% High school diploma or equivalent | 12% Some college, no degree",High school diploma or equivalent,57%,"Bore Mill Operator, Computer Numerical Control Drilling Operator (CNC Drilling Operator), Drill Operator, Drill Press Operator, Drill Setup Operator, Driller, Machine Operator, Machinist, Punch Operator, Radial Drill Operator","Set up, operate, or tend drilling machines to drill, bore, ream, mill, or countersink metal or plastic work pieces.",https://altpath.org/discover/ei9lufc5pe6tswy7eg39b24r,Metal & Plastic Drilling Machine Operator,17.0,1.0,5.9,,,68.18181818181817,3.3181817531585693,14.156124009100315
2.0,53-3031.00,Driver/Sales Workers,Y,https://www.onetonline.org/link/summary/53-3031.00,"$17.85 hourly, $37,130 annual",Much faster than average (7% or higher),8.8,"51,300",High school diploma,High school diploma,,"Delivery Driver, Delivery Man, Driver, Driver Sales, Driver Salesman, Pizza Delivery Driver, Route Driver, Route Sales Driver, Route Salesman, Sales Route Driver","Drive truck or other vehicle over established routes or within an established territory and sell or deliver goods, such as food products, including restaurant take-out items, or pick up or deliver items such as commercial laundry. May also take orders, collect payment, or stock merchandise at point of delivery. Includes newspaper delivery drivers.",https://altpath.org/discover/h1hvgil4ubco3vh75upzsngq,Driver/Sales Worker,11.0,2.0,18.2,37.56293072207075,25.675675675675677,72.42585091324602,3.44096259489707,5.89142959839705
2.0,47-2081.00,Drywall and Ceiling Tile Installers,Y,https://www.onetonline.org/link/summary/47-2081.00,"$27.95 hourly, $58,140 annual",Average (3% to 4%),4.2,"7,700",42% Less than high school diploma | 24% High school diploma or equivalent,Less than high school diploma,42%,"Ceiling Installer, Dry Wall Installer, Drywall Finisher, Drywall Hanger, Drywall Installer, Drywall Mechanic, Drywaller, Exterior Interior Specialist, Metal Framer, Metal Stud Framer","Apply plasterboard or other wallboard to ceilings or interior walls of buildings. Apply or mount acoustical tiles or blocks, strips, or sheets of shock-absorbing materials to ceilings and walls of buildings to reduce or reflect sound. Materials may be of decorative quality. Includes lathers who fasten wooden, metal, or rockboard lath to walls, ceilings or partitions of buildings to provide support base for plaster, fire-proofing, or acoustical material.",https://altpath.org/discover/ezwlb76eh5flcfu15uxl9tvv,Drywall Installer,26.0,2.0,7.7,33.33333333333333,26.923076923076923,75.75310182479278,3.018004761065633,7.568612564243446
2.0,47-5023.00,"Earth Drillers, Except Oil and Gas",Y,https://www.onetonline.org/link/summary/47-5023.00,"$28.65 hourly, $59,600 annual",Average (3% to 4%),2.9,"1,700",73% High school diploma or equivalent | 15% Less than high school diploma,High school diploma or equivalent,73%,"Blast Hole Driller, Diamond Driller, Drill Operator, Driller, Hard Rock Drill Operator, Highwall Drill Operator, Rock Drill Operator, Underground Drill Operator, Water Well Driller, Well Driller","Operate a variety of drills such as rotary, churn, and pneumatic to tap subsurface water and salt deposits, to remove core samples during mineral exploration or soil testing, and to facilitate the use of explosives in mining or construction. Includes horizontal and earth boring machine operators.",https://altpath.org/discover/imddn2jeon47jz1xyiofnq12,Earth Driller,29.0,0.0,0.0,,,,,
5.0,25-1063.00,"Economics Teachers, Postsecondary",Y,https://www.onetonline.org/link/summary/25-1063.00,"$119,980 annual",Slower than average (1% to 2%),2.1,"1,200",81% Doctoral degree | 10% Post-master’s certificate,Doctoral degree,81%,"Assistant Professor, Assistant Professor of Economics, Associate Professor, Associate Professor of Economics, Economics Instructor, Economics Professor, Instructor, Lecturer, Professor, Professor of Economics",Teach courses in economics. Includes both teachers primarily engaged in teaching and those who do a combination of teaching and research.,https://altpath.org/discover/eo6ygikpylapa6dzdkjjw9jv,Postsecondary Economics Teacher,22.0,17.0,77.3,31.782981514388897,40.78692175836921,71.17819206359113,3.3521147585467337,13.033060375432584
5.0,19-3011.00,Economists,Y,https://www.onetonline.org/link/summary/19-3011.00,"$55.50 hourly, $115,440 annual",Slower than average (1% to 2%),1.2,900,50% Master’s degree | 25% Doctoral degree,Master's degree,50%,"Economic Analysis Director, Economic Analyst, Economic Consultant, Economist, Forensic Economist, Health Researcher, Professor, Professor of Economics, Project Economist, Research Analyst","Conduct research, prepare reports, or formulate plans to address economic problems related to the production and distribution of goods and services or monetary and fiscal policy. May collect and process economic and statistical data using sampling techniques and econometric methods.",https://altpath.org/discover/ofumrvj2oosdcyrjfmaoqm1i,Economist,14.0,5.0,35.7,30.529231502065215,44.21322437640199,60.64486344072598,3.3838187674450153,15.92419086605111
4.0,27-3041.00,Editors,Y,https://www.onetonline.org/link/summary/27-3041.00,"$36.18 hourly, $75,260 annual",Slower than average (1% to 2%),0.6,"9,800",80% Bachelor’s degree | 17% Master’s degree,Bachelor's degree,80%,"Acquisitions Editor, Business Editor, Editor, Features Editor, Legal Editor, News Editor, Newspaper Copy Editor, Science Editor, Sports Editor, Web Editor","Plan, coordinate, or edit content of material for publication. May review proposals and drafts for possible publication. Includes technical editors.",https://altpath.org/discover/g700ii7cp36qna13v5rz2kxb,Editor,21.0,9.0,42.9,33.39165778581195,18.093871011547428,69.41727114665584,3.329965885899056,10.180278940526804
,11-9039.00,"Education Administrators, All Other",,https://www.onetonline.org/link/summary/11-9039.00,"$42.81 hourly, $89,040 annual",Average (3% to 4%),2.5,"4,100",,,,,All education administrators not listed separately.,,,,,,,,,,
5.0,11-9032.00,"Education Administrators, Kindergarten through Secondary",Y,https://www.onetonline.org/link/summary/11-9032.00,"$104,070 annual",Decline (-1% or lower),-1.5,"20,800",61% Master’s degree | 24% Bachelor’s degree,Master's degree,61%,"Athletic Director, Elementary Principal, High School Principal, Middle School Principal, Principal, School Administrator, School Superintendent, Special Education Director, Superintendent, Vice Principal","Plan, direct, or coordinate the academic, administrative, or auxiliary activities of public or private elementary or secondary level schools.",https://altpath.org/discover/uzsmro8ccwez9csx1c4bsxoi,Education Administrator,32.0,7.0,21.9,33.3340709176041,22.40114959794684,72.27664632671261,3.405849269879585,11.688230507503487
5.0,11-9033.00,"Education Administrators, Postsecondary",Y,https://www.onetonline.org/link/summary/11-9033.00,"$49.98 hourly, $103,960 annual",Slower than average (1% to 2%),1.7,"15,100",48% Master’s degree | 37% Doctoral degree,Master's degree,48%,"Academic Affairs Vice President, Academic Dean, Admissions Director, College President, Dean, Financial Aid Director, Institutional Research Director, Provost, Registrar, Students Dean","Plan, direct, or coordinate research, instructional, student administration and services, and other educational activities at postsecondary institutions, including universities, colleges, and junior and community colleges.",https://altpath.org/discover/w7dq2j3aizj1spk9jk89zz2a,Postsecondary Education Administrator,27.0,9.0,33.3,39.595395945767955,33.7719298245614,72.84863335468626,3.3325115260661464,12.61919381530305
