Job Zone,onet_code,Occupation,Data-level,url,Median Wage,Projected Growth,"Employment Change, 2024-2034",Projected Job Openings,Education,Top Education Level,Top Education Rate,Sample Job Titles,Job Description,altpath url,altpath simple title,total_tasks,aei_tasks,ai_task_coverage_pct,weighted_automation_pct,weighted_augmentation_pct,weighted_task_success_pct,weighted_ai_autonomy_mean,weighted_speedup_factor
3.0,33-3051.00,Police and Sheriff's Patrol Officers,Y,https://www.onetonline.org/link/summary/33-3051.00,"$36.68 hourly, $76,290 annual",Average (3% to 4%),3.1,"53,700",40% High school diploma or equivalent | 21% Post-secondary certificate,High school diploma or equivalent,40%,"Deputy, Deputy Sheriff, Law Enforcement Officer, Patrol Deputy, Patrol Officer, Peace Officer, Police Officer, Police Patrol Officer, Public Safety Officer, State Trooper","Maintain order and protect life and property by enforcing local, tribal, State, or Federal laws and ordinances. Perform a combination of the following duties: patrol a specific area; direct traffic; issue traffic summonses; investigate accidents; apprehend and arrest suspects, or serve legal processes of courts.",https://altpath.org/discover/nq7vw3jorqm2yr0ruhw9elhq,Police Patrol Officer,30.0,2.0,6.7,60.0,20.0,60.3736523230145,2.852426084100101,8.795618045035582
3.0,33-3021.02,Police Identification and Records Officers,Y,https://www.onetonline.org/link/summary/33-3021.02,"$44.99 hourly, $93,580 annual",Decline (-1% or lower),,"7,800","35% High school diploma or equivalent | 29% Some college, no degree",High school diploma or equivalent,35%,"Crime Scene Evidence Technician, Crime Scene Investigator, Crime Scene Technician, Criminalist, Field Identification Specialist, Forensic Specialist, Identification Officer, Identification Technician, Latent Fingerprint Examiner, Latent Print Examiner","Collect evidence at crime scene, classify and identify fingerprints, and photograph evidence for use in criminal and civil cases.",https://altpath.org/discover/ptmnhpwi1n5b0ygfhfsl7wj5,Police Records Officer,16.0,0.0,0.0,,,,,
5.0,25-1065.00,"Political Science Teachers, Postsecondary",Y,https://www.onetonline.org/link/summary/25-1065.00,"$94,680 annual",Slower than average (1% to 2%),2.0,"1,600",97% Doctoral degree | 3% Master’s degree,Doctoral degree,97%,"Adjunct Professor, Assistant Professor of Political Science, Associate Professor, Associate Professor of Political Science, Government Professor, Instructor, Political Science Instructor, Political Science Professor, Professor, Professor of Political Science","Teach courses in political science, international affairs, and international relations. Includes both teachers primarily engaged in teaching and those who do a combination of teaching and research.",https://altpath.org/discover/guyn0wlyac2ods7bjjw9qjsd,Postsecondary Political Science Teacher,22.0,17.0,77.3,31.5414138594646,40.35370825523273,71.7675373568331,3.3593721396823364,12.808820598920295
5.0,19-3094.00,Political Scientists,Y,https://www.onetonline.org/link/summary/19-3094.00,"$67.01 hourly, $139,380 annual",Decline (-1% or lower),-3.1,500,88% Doctoral degree | 8% Master’s degree,Doctoral degree,88%,"International Affairs Vice President, State-Federal Relations Deputy Director","Study the origin, development, and operation of political systems. May study topics, such as public opinion, political decision-making, and ideology. May analyze the structure and operation of governments, as well as various political entities. May conduct public opinion surveys, analyze election results, or analyze public documents.",https://altpath.org/discover/rqzm78pge3ufn5f48x2xnpbf,Political Scientist,14.0,7.0,50.0,27.809610896674258,66.04694826695416,69.37276670623693,3.5338291379449704,15.43547796614071
2.0,43-5051.00,Postal Service Clerks,Y,https://www.onetonline.org/link/summary/43-5051.00,"$29.63 hourly, $61,630 annual",Decline (-1% or lower),-3.5,"6,100","68% High school diploma or equivalent | 18% Some college, no degree",High school diploma or equivalent,68%,"Bulk Mail Technician, Clerk, Distribution Clerk, Part Time Flexible Clerk (PTF Clerk), Postal Clerk, Sales & Service Associate (SSA), Sales and Distribution Clerk, Sales and Service Associate (SSA), Window Clerk, Window/Distribution Clerk","Perform any combination of tasks in a post office, such as receive letters and parcels; sell postage and revenue stamps, postal cards, and stamped envelopes; fill out and sell money orders; place mail in pigeon holes of mail rack or in bags; and examine mail for correct postage.",https://altpath.org/discover/wqjm04lbsstkgmoky94a94g2,Postal Service Clerk,19.0,1.0,5.3,,,77.27272727272727,2.6363637447357178,5.411650108102229
2.0,43-5052.00,Postal Service Mail Carriers,Y,https://www.onetonline.org/link/summary/43-5052.00,"$27.64 hourly, $57,490 annual",Decline (-1% or lower),-3.5,"20,600",78% High school diploma or equivalent | 15% Less than high school diploma,High school diploma or equivalent,78%,"City Carrier, City Carrier Assistant (CCA), City Letter Carrier, City Mail Carrier, Letter Carrier, Mail Carrier, Rural Carrier, Rural Carrier Associate (RCA), Rural Mail Carrier, Rural Route Carrier",Sort mail for delivery. Deliver mail on established route by vehicle or on foot.,https://altpath.org/discover/j4albfuwsi62bknjza8908fh,Postal Service Mail Carrier,21.0,1.0,4.8,,,69.44444444444444,2.805555582046509,5.215233278177091
2.0,43-5053.00,"Postal Service Mail Sorters, Processors, and Processing Machine Operators",Y,https://www.onetonline.org/link/summary/43-5053.00,"$27.18 hourly, $56,530 annual",Decline (-1% or lower),-8.4,"7,800",81% High school diploma or equivalent | 12% Less than high school diploma,High school diploma or equivalent,81%,"Automation Clerk, Computer Forwarding System Markup Clerk (CFS Markup Clerk), Distribution Clerk, Flat Sorting Machine Clerk (FSM Clerk), Mail Handler, Mail Handler Equipment Operator, Mail Processing Clerk, Mail Processor, Parcel Post Distribution Machine Operator (PDPMO), Small Package and Bundle Sorter Clerk (SPBS Clerk)","Prepare incoming and outgoing mail for distribution. Examine, sort, and route mail. Load, operate, and occasionally adjust and repair mail processing, sorting, and canceling machinery. Keep records of shipments, pouches, and sacks; and other duties related to mail handling within the postal service.",https://altpath.org/discover/dvyp3k2pihoy9ce1u5fjet3w,Postal Mail Machine Operator,14.0,0.0,0.0,,,,,
2.0,11-9131.00,Postmasters and Mail Superintendents,Y,https://www.onetonline.org/link/summary/11-9131.00,"$44.58 hourly, $92,730 annual",Decline (-1% or lower),-3.5,900,62% High school diploma or equivalent | 13% Bachelor’s degree,High school diploma or equivalent,62%,"Delivery Supervisor, Distribution Operation Supervisor (SDO), Distribution Operations Manager, Distribution Operations Supervisor, Mail Delivery Supervisor, Postal Supervisor, Postmaster, Postmaster Relief (PMR), Remote Encoding Center Manager, Remote Encoding Operations Supervisor","Plan, direct, or coordinate operational, administrative, management, and supportive services of a U.S. post office; or coordinate activities of workers engaged in postal and related work in assigned post office.",https://altpath.org/discover/xjt3v6etv5mjmppkpwv449xm,Postmaster,13.0,0.0,0.0,,,,,
,25-1199.00,"Postsecondary Teachers, All Other",,https://www.onetonline.org/link/summary/25-1199.00,"$78,490 annual",Slower than average (1% to 2%),1.8,"13,500",,,,,All postsecondary teachers not listed separately.,https://altpath.org/discover/v374mbh75s3o0z96oeszmkj8,Postsecondary Teachers,,,,,,,,
3.0,51-9195.05,"Potters, Manufacturing",Y,https://www.onetonline.org/link/summary/51-9195.05,"$21.97 hourly, $45,690 annual",Faster than average (5% to 6%),,"5,500","31% Some college, no degree | 30% High school diploma or equivalent","Some college, no degree",31%,"Clay Mixer, Glazer, Jigger Artisan, Jigger Machine Operator, Potter, Production Potter","Operate production machines such as pug mill, jigger machine, or potter's wheel to process clay in manufacture of ceramic, pottery and stoneware products.",https://altpath.org/discover/f4auj7kez73ce2c2pj3o7iw9,Potter,23.0,0.0,0.0,,,,,
2.0,51-4052.00,"Pourers and Casters, Metal",Y,https://www.onetonline.org/link/summary/51-4052.00,"$23.53 hourly, $48,940 annual",Decline (-1% or lower),-4.7,600,80% High school diploma or equivalent | 20% Less than high school diploma,High school diploma or equivalent,80%,"Casting Machine Operator, Casting Operator, Die Cast Operator (DCO), Direct Chill Caster (DC Caster), Iron Pourer, Ladleman, Melter, Metal Handler, Pourer, Vacuum Caster",Operate hand-controlled mechanisms to pour and regulate the flow of molten metal into molds to produce castings or ingots.,https://altpath.org/discover/dwzkabearzuswz4cxqilfsp0,Metal Caster,16.0,0.0,0.0,,,,,
3.0,51-8012.00,Power Distributors and Dispatchers,Y,https://www.onetonline.org/link/summary/51-8012.00,"$51.56 hourly, $107,240 annual",Decline (-1% or lower),-3.2,800,40% Post-secondary certificate | 24% Associate’s degree,Post-secondary certificate,40%,"Control Operator, Distribution Dispatcher, Distribution Operations Supervisor, Distribution System Operator, Electric System Operator, Journeyman Lineman, Power System Dispatcher, Power System Operator, System Operator, Transmission System Operator","Coordinate, regulate, or distribute electricity or steam.",https://altpath.org/discover/vagewgwr4xamjnmf0bzaphzd,Power Distributor,14.0,2.0,14.3,,,,3.4657017014829496,15.635104441645083
2.0,51-8013.00,Power Plant Operators,Y,https://www.onetonline.org/link/summary/51-8013.00,"$47.92 hourly, $99,670 annual",Decline (-1% or lower),-11.2,"2,500",60% High school diploma or equivalent | 14% Associate’s degree,High school diploma or equivalent,60%,"Auxiliary Operator, Control Operator, Control Room Operator, Multicraft Operator (MCO), Operations and Maintenance Technician (O & M Technician), Plant Control Operator, Power Plant Operator, Senior Power Plant Operator, Station Operator, Unit Operator","Control, operate, or maintain machinery to generate electric power. Includes auxiliary equipment operators.",https://altpath.org/discover/ezezld83b7g2mmlca1o7hutm,Power Plant Operator,30.0,2.0,6.7,39.94420594931866,35.77981651376147,60.682271030716656,3.158811638849747,13.206585675910596
3.0,19-4012.01,Precision Agriculture Technicians,Y,https://www.onetonline.org/link/summary/19-4012.01,"$22.49 hourly, $46,790 annual",Average (3% to 4%),,"2,900",35% Bachelor’s degree | 30% Associate’s degree,Bachelor's degree,35%,"Agrintelligence Specialist (Agriculture Intelligence Specialist), Agronomist, Agronomy Consultant, Crop Consultant, Crop Specialist, Precision Agriculture Analyst (Precision Ag Analyst), Precision Agriculture Specialist (Precision Ag Specialist), Precision Agronomist, Precision Farming Coordinator, Precision Technology Agronomist (Precision Tech Agronomist)","Apply geospatial technologies, including geographic information systems (GIS) and Global Positioning System (GPS), to agricultural production or management activities, such as pest scouting, site-specific pesticide application, yield mapping, or variable-rate irrigation. May use computers to develop or analyze maps or remote sensing images to compare physical topography with data on soils, fertilizer, pests, or weather.",https://altpath.org/discover/muwv6kev7u03hf0882cx8eq3,Precision Agriculture Technician,22.0,4.0,18.2,,,,3.214656639491745,12.826913725638986
,49-9069.00,"Precision Instrument and Equipment Repairers, All Other",,https://www.onetonline.org/link/summary/49-9069.00,"$32.25 hourly, $67,080 annual",Slower than average (1% to 2%),2.0,"1,000",,,,,All precision instrument and equipment repairers not listed separately.,,,,,,,,,,
3.0,51-5111.00,Prepress Technicians and Workers,Y,https://www.onetonline.org/link/summary/51-5111.00,"$22.74 hourly, $47,300 annual",Decline (-1% or lower),-14.6,"2,800",39% High school diploma or equivalent | 23% Associate’s degree,High school diploma or equivalent,39%,"Desktop Operator, Electronic Prepress Operator (EPP Operator), Electronic Prepress Technician (EPP Tech), Plate Maker, Plate Mounter, Pre-Press Proofer, Prepress Operator, Prepress Specialist, Prepress Stripper, Prepress Technician",Format and proof text and images submitted by designers and clients into finished pages that can be printed. Includes digital and photo typesetting. May produce printing plates.,https://altpath.org/discover/c0l9hwacbq0jhdehzne105jx,Prepress Technician,15.0,1.0,6.7,58.1967213114754,,69.67213114754098,2.8565573692321773,15.741319729642052
3.0,25-2011.00,"Preschool Teachers, Except Special Education",Y,https://www.onetonline.org/link/summary/25-2011.00,"$17.85 hourly, $37,120 annual",Average (3% to 4%),4.1,"65,500",29% High school diploma or equivalent | 17% Bachelor’s degree,High school diploma or equivalent,29%,"Early Childhood Teacher, Group Teacher, Head Start Teacher, Headstart Teacher, Lead Teacher, Pre-Kindergarten Teacher (Pre-K Teacher), Preschool Teacher, Teacher, Teacher Assistant, Toddler Teacher","Instruct preschool-aged children in activities designed to promote social, physical, and intellectual growth needed for primary school in preschool, day care center, or other child development facility. May be required to hold State certification.",https://altpath.org/discover/agtsdp88dyxu5q5cr71l0bzx,Preschool Teacher,34.0,13.0,38.2,46.75749787732817,24.120603015075375,83.13086912092864,3.592469406581654,12.574970521334212
1.0,51-6021.00,"Pressers, Textile, Garment, and Related Materials",Y,https://www.onetonline.org/link/summary/51-6021.00,"$16.29 hourly, $33,880 annual",Decline (-1% or lower),-13.5,"2,800",59% Less than high school diploma | 26% High school diploma or equivalent,Less than high school diploma,59%,"Boarder, Dry Cleaner Presser, Garment Presser, Ironing Machine Operator, Ironing Worker, Pants Presser, Presser, Pressing Machine Operator, Shirt Presser, Silk Presser",Press or shape articles by hand or machine.,https://altpath.org/discover/i0gn62ttgie74f32gf3bin8y,Textile Presser,28.0,0.0,0.0,,,,,
5.0,29-1229.05,Preventive Medicine Physicians,Y,https://www.onetonline.org/link/summary/29-1229.05,"$115.00+ hourly, $239,200+ annual",Average (3% to 4%),,"9,600",74% Post-doctoral training | 26% Doctoral degree,Post-doctoral training,74%,"Occupational Medicine Physician, Occupational Physician, Physician, Preventive Medicine Physician, Primary Clinician, Public Health Officer, Public Health Physician","Apply knowledge of general preventive medicine and public health issues to promote health care to groups or individuals, and aid in the prevention or reduction of risk of disease, injury, disability, or death. May practice population-based medicine or diagnose and treat patients in the context of clinical health promotion and disease prevention.",https://altpath.org/discover/ty02z8lrhgzz5mufgmq7etde,Preventive Medicine Physician,15.0,2.0,13.3,,60.0,64.44444444444444,3.2915578945106416,15.58493538251172
2.0,51-5113.00,Print Binding and Finishing Workers,Y,https://www.onetonline.org/link/summary/51-5113.00,"$19.14 hourly, $39,820 annual",Decline (-1% or lower),-16.1,"2,800",88% High school diploma or equivalent | 4% Less than high school diploma,High school diploma or equivalent,88%,"Binder Operator, Bindery Operator, Bindery Production Manager, Bindery Technician, Bindery Worker, Book Binder, Custom Bookbinder, Machine Operator, Perfect Binder Operator, Production Associate",Bind books and other publications or finish printed products by hand or machine. May set up binding and finishing machines.,https://altpath.org/discover/yuxd22xqzksux6k3upe74ep8,Print Binding Worker,25.0,0.0,0.0,,,,,
2.0,51-5112.00,Printing Press Operators,Y,https://www.onetonline.org/link/summary/51-5112.00,"$21.71 hourly, $45,160 annual",Decline (-1% or lower),-8.1,"13,700",73% High school diploma or equivalent | 19% Post-secondary certificate,High school diploma or equivalent,73%,"1st Pressman, 2nd Pressman, Flexographic Press Operator, Offset Pressman, Press Leader, Press Operator, Pressman, Printer, Printing Press Operator, Printing Pressman","Set up and operate digital, letterpress, lithographic, flexographic, gravure, or other printing machines. Includes short-run offset printing presses.",https://altpath.org/discover/lq4qlhivaoup38lbcfg9eyst,Printing Press Operator,23.0,0.0,0.0,,,,,
3.0,33-9021.00,Private Detectives and Investigators,Y,https://www.onetonline.org/link/summary/33-9021.00,"$25.18 hourly, $52,370 annual",Faster than average (5% to 6%),6.0,"3,900",38% Bachelor’s degree | 25% High school diploma or equivalent,Bachelor's degree,38%,"Asset Protection Detective, Field Investigator, Investigator, Loss Prevention Agent, Loss Prevention Associate, Loss Prevention Detective, Loss Prevention Investigator, Loss Prevention Officer, Private Investigator, Special Investigator","Gather, analyze, compile and report information regarding individuals or organizations to clients, or detect occurrences of unlawful acts or infractions of rules in private establishment.",https://altpath.org/discover/xtjhmvt4kpt8hr0mb5zzj1oa,Private Detective,14.0,2.0,14.3,,38.63636363636363,,3.273372780943699,10.653078630644591
4.0,21-1092.00,Probation Officers and Correctional Treatment Specialists,Y,https://www.onetonline.org/link/summary/21-1092.00,"$31.02 hourly, $64,520 annual",Average (3% to 4%),2.6,"7,900",88% Bachelor’s degree | 5% Associate’s degree,Bachelor's degree,88%,"Adult Probation Officer, Correctional Counselor, Deputy Juvenile Officer, Deputy Probation Officer (DPO), Juvenile Probation Officer, Parole Agent, Parole Officer, Probation and Parole Officer, Probation Counselor, Probation Officer","Provide social services to assist in rehabilitation of law offenders in custody or on probation or parole. Make recommendations for actions involving formulation of rehabilitation plan and treatment of offender, including conditional release and education and employment stipulations.",https://altpath.org/discover/bmqhs2dhe5n61h8s7sucrm89,Probation Officer,21.0,0.0,0.0,,,,,
2.0,43-3061.00,Procurement Clerks,Y,https://www.onetonline.org/link/summary/43-3061.00,"$23.32 hourly, $48,510 annual",Decline (-1% or lower),-8.7,"4,600",48% High school diploma or equivalent | 33% Bachelor’s degree,High school diploma or equivalent,48%,"Buyer, Procurement Assistant, Procurement Officer, Procurement Specialist, Procurement Technician, Purchasing Assistant, Purchasing Associate, Purchasing Clerk, Purchasing Specialist, Warehouse Clerk",Compile information and records to draw up purchase orders for procurement of materials and services.,https://altpath.org/discover/rlb46anifskcapppe59cd6ni,Procurement Clerk,19.0,4.0,21.1,53.54865831486043,,57.37684757325128,2.989820424994312,13.677580025208222
4.0,27-2012.00,Producers and Directors,Y,https://www.onetonline.org/link/summary/27-2012.00,"$40.13 hourly, $83,480 annual",Faster than average (5% to 6%),4.9,"12,800",57% Bachelor’s degree | 15% High school diploma or equivalent,Bachelor's degree,57%,"Artistic Director, Director, Executive Producer, Multimedia Producer, News Producer, Producer, Production Director, Radio Producer, Television News Producer (TV News Producer), Television Producer (TV Producer)","Produce or direct stage, television, radio, video, or motion picture productions for entertainment, information, or instruction. Responsible for creative decisions, such as interpretation of script, choice of actors or guests, set design, sound, special effects, and choreography.",https://altpath.org/discover/bl06m8g12rau8rrs99oy75kx,TV or Film Director,30.0,12.0,40.0,39.71247349811733,18.663234350619096,63.83428301458162,3.232938319890238,12.235373486326102
,51-9199.00,"Production Workers, All Other",,https://www.onetonline.org/link/summary/51-9199.00,"$18.66 hourly, $38,820 annual",Slower than average (1% to 2%),0.5,"31,600",,,,,All production workers not listed separately.,https://altpath.org/discover/q0tga04cy1x8xc5v916jyd26,Production Workers,,,,,,,,
2.0,43-5061.00,"Production, Planning, and Expediting Clerks",Y,https://www.onetonline.org/link/summary/43-5061.00,"$27.78 hourly, $57,770 annual",Decline (-1% or lower),-1.8,"34,100","37% High school diploma or equivalent | 21% Some college, no degree",High school diploma or equivalent,37%,"Master Scheduler, Material Coordinator, Materials Planner, Planner, Production Assistant, Production Clerk, Production Controller, Production Planner, Production Scheduler, Scheduler","Coordinate and expedite the flow of work and materials within or between departments of an establishment according to production schedule. Duties include reviewing and distributing production, work, and shipment schedules; conferring with department supervisors to determine progress of work and completion dates; and compiling reports on progress of work, inventory levels, costs, and production problems.",https://altpath.org/discover/i781oaeacwtupktfmc3tvk5p,Production Clerk,17.0,2.0,11.8,57.14285714285714,,75.54101794789781,3.141733327301182,11.593888314271975
4.0,13-1082.00,Project Management Specialists,Y,https://www.onetonline.org/link/summary/13-1082.00,"$48.44 hourly, $100,750 annual",Faster than average (5% to 6%),5.6,"78,200",Bachelor's degree,Bachelor's degree,,,"Analyze and coordinate the schedule, timeline, procurement, staffing, and budget of a product or service on a per project basis. Lead and guide the work of technical staff. May serve as a point of contact for the client or customer.",https://altpath.org/discover/of9jucf2c0rtj8xhoa3dxx9m,Project Management Specialist,20.0,2.0,10.0,,,79.16666666666666,3.416666626930237,21.183941412503792
4.0,43-9081.00,Proofreaders and Copy Markers,Y,https://www.onetonline.org/link/summary/43-9081.00,"$23.66 hourly, $49,210 annual",Decline (-1% or lower),-0.6,"1,900",47% Bachelor’s degree | 23% Associate’s degree,Bachelor's degree,47%,"Content Editor, Copy Chief, Copy Editor, Copyholder, Desk Editor, Editorial Assistant, News Copy Editor, Proofer, Proofreader, Typesetter","Read transcript or proof type setup to detect and mark for correction any grammatical, typographical, or compositional errors. Includes proofreaders of Braille.",https://altpath.org/discover/m1lf9y6cgthk31e0zoxce4xz,Proofreader,11.0,1.0,9.1,26.339285714285715,20.982142857142858,70.3125,3.0200893878936768,8.938281169848835
4.0,11-9141.00,"Property, Real Estate, and Community Association Managers",Y,https://www.onetonline.org/link/summary/11-9141.00,"$32.07 hourly, $66,700 annual",Average (3% to 4%),3.6,"39,000",55% Bachelor’s degree | 15% High school diploma or equivalent,Bachelor's degree,55%,"Apartment Manager, Commercial Property Services Coordinator, Community Manager, Condominium Association Property Manager, Consulting Property Manager, Lease Administration Supervisor, Leasing Manager, On Site Property Manager, Property Manager, Resident Manager","Plan, direct, or coordinate the selling, buying, leasing, or governance activities of commercial, industrial, or residential real estate properties. Includes managers of homeowner and condominium associations, rented or leased housing units, buildings, or land (including rights-of-way).",https://altpath.org/discover/tsjhn0258zr9ic3ferdscn1z,Property Manager,27.0,8.0,29.6,35.2825004041418,11.560693641618496,72.13830956404396,3.197293180983074,9.70920854261444
5.0,29-1024.00,Prosthodontists,Y,https://www.onetonline.org/link/summary/29-1024.00,"$115.00+ hourly, $239,200+ annual",Faster than average (5% to 6%),4.5,0,61% Post-doctoral training | 36% Doctoral degree,Post-doctoral training,61%,"Doctor of Dental Science, Prosthodontist, Doctor of Dental Surgery (DDS), Maxillofacial Prosthodontist, Prosthetic Dentist, Prosthodontist, Prosthodontist, Assistant Clinical Professor, Prosthodontist/Educator, Prosthodontist/Owner, Prosthodontist/Restorative/Reconstructive Dentist, Removable Prosthodontist","Construct oral prostheses to replace missing teeth and other oral structures to correct natural and acquired deformation of mouth and jaws, to restore and maintain oral function, such as chewing and speaking, and to improve appearance.",https://altpath.org/discover/la398tqrkm5b3s6ndojl0mml,Prosthodontist,12.0,0.0,0.0,,,,,
,33-9099.00,"Protective Service Workers, All Other",,https://www.onetonline.org/link/summary/33-9099.00,"$20.00 hourly, $41,600 annual",Average (3% to 4%),2.5,"23,300",,,,,All protective service workers not listed separately.,https://altpath.org/discover/l44352l7w6j1k9esdwfus8tz,Protective Service Workers,,,,,,,,
2.0,31-1133.00,Psychiatric Aides,Y,https://www.onetonline.org/link/summary/31-1133.00,"$20.00 hourly, $41,590 annual",Little or no change,-0.4,"5,300","46% Some college, no degree | 24% High school diploma or equivalent","Some college, no degree",46%,"Developmental Aide, Mental Health Aide (MHA), Mental Health Worker (MHW), Psychiatric Aide, Psychiatric Assistant, Psychiatric Nursing Aide, Qualified Medication Aide (QMA), Resident Care Technician (Resident Care Tech), Residential Care Tech (Residential Care Technician), Therapeutic Program Worker (TPW)","Assist mentally impaired or emotionally disturbed patients, working under direction of nursing and medical staff. May assist with daily living activities, lead patients in educational and recreational activities, or accompany patients to and from examinations and treatments. May restrain violent patients. Includes psychiatric orderlies.",https://altpath.org/discover/vvvezg0j2e0kcbts7qcddi1a,Psychiatric Aide,17.0,1.0,5.9,,43.103448275862064,68.96551724137932,3.775861978530884,4.052272627084383
