Job Zone,onet_code,Occupation,Data-level,url,Median Wage,Projected Growth,"Employment Change, 2024-2034",Projected Job Openings,Education,Top Education Level,Top Education Rate,Sample Job Titles,Job Description,altpath url,altpath simple title,total_tasks,aei_tasks,ai_task_coverage_pct,weighted_automation_pct,weighted_augmentation_pct,weighted_task_success_pct,weighted_ai_autonomy_mean,weighted_speedup_factor
4.0,13-2011.00,Accountants and Auditors,Y,https://www.onetonline.org/link/summary/13-2011.00,"$39.27 hourly, $81,680 annual",Faster than average (5% to 6%),4.6,"124,200",Bachelor's degree,Bachelor's degree,,"Accountant, Accounting Officer, Audit Partner, Auditor, Certified Public Accountant (CPA), Cost Accountant, Financial Auditor, General Accountant, Internal Auditor, Revenue Tax Specialist","Examine, analyze, and interpret accounting records to prepare financial statements, give advice, or audit and evaluate statements prepared by others. Install or advise on systems of recording costs or other financial and budgetary data.",https://altpath.org/discover/b9wk32fskvzsllwxszle3nas,Accountant,29.0,8.0,27.6,41.91294646728085,21.1342940517339,63.93533196605576,3.3041829953627286,15.730828754810627
2.0,27-2011.00,Actors,Y,https://www.onetonline.org/link/summary/27-2011.00,$23.33 hourly,Little or no change,0.3,"6,300",45% Less than high school diploma | 21% Bachelor’s degree,Less than high school diploma,45%,"Actor, Actress, Comedian, Comic, Community Theater Actor, Ensemble Member, Narrator, Performer, Tour Actor, Voice-Over Artist","Play parts in stage, television, radio, video, motion picture productions, or other settings for entertainment, information, or instruction. Interpret serious or comic role by speech, gesture, and body movement to entertain or inform audience. May dance and sing.",https://altpath.org/discover/ujyoph0ljccmlbu2nxobb8nz,Actor,18.0,7.0,38.9,38.12480202322591,17.920442498821405,82.06450695033865,3.4407554087880974,8.177923571124813
4.0,15-2011.00,Actuaries,Y,https://www.onetonline.org/link/summary/15-2011.00,"$60.47 hourly, $125,770 annual",Much faster than average (7% or higher),21.8,"2,400",79% Bachelor’s degree | 11% Post-baccalaureate certificate,Bachelor's degree,79%,"Actuarial Analyst, Actuarial Associate, Actuarial Consultant, Actuary, Consulting Actuary, Health Actuary, Pricing Actuary, Pricing Analyst, Product Development Actuary, Retirement Actuary","Analyze statistical data, such as mortality, accident, sickness, disability, and retirement rates and construct probability tables to forecast risk and liability for payment of future benefits. May ascertain insurance rates required and cash reserves necessary to ensure payment of future benefits.",https://altpath.org/discover/u27b0gb84uyrciys4b46u555,Actuary,15.0,3.0,20.0,18.187001140250857,36.545039908779934,78.26007237147303,3.4957801414914194,11.471546668627262
5.0,29-1291.00,Acupuncturists,Y,https://www.onetonline.org/link/summary/29-1291.00,"$37.57 hourly, $78,140 annual",Much faster than average (7% or higher),6.8,900,68% Master’s degree | 14% Doctoral degree,Master's degree,68%,"Acupuncture Doctor, Acupuncture Physician, Acupuncture Provider, Acupuncturist, Chinese Medical Doctor (Chinese MD), Chinese Medicine Doctor, Herbalist, Licensed Acupuncturist (LAC), Oriental Medicine Provider, Traditional Chinese Medicine Doctor","Diagnose, treat, and prevent disorders by stimulating specific acupuncture points within the body using acupuncture needles. May also use cups, nutritional supplements, therapeutic massage, acupressure, and other alternative health therapies.",https://altpath.org/discover/p4tcovyot1mehwun08mq0swd,Acupuncturist,18.0,4.0,22.2,,42.38871335980237,80.04449683225265,3.5595614436359924,9.398803252745235
4.0,29-1141.01,Acute Care Nurses,Y,https://www.onetonline.org/link/summary/29-1141.01,"$45.00 hourly, $93,600 annual",Faster than average (5% to 6%),,"189,100",57% Bachelor’s degree | 19% Associate’s degree,Bachelor's degree,57%,"Charge Nurse, Charge Nurse, Cardiac Interventional Care, Clinical Educator, Clinical Nurse Educator, Clinical Staff Educator, Nurse Manager, Nursing Director, Preceptor, Progressive Care Unit Registered Nurse, Staff Nurse","Provide advanced nursing care for patients with acute conditions such as heart attacks, respiratory distress syndrome, or shock. May care for pre- and post-operative patients or perform advanced, invasive diagnostic or therapeutic procedures.",https://altpath.org/discover/xszwhld49yh7swe9lhxuabdr,Acute Care Nurse,27.0,5.0,18.5,28.749999999999996,57.996826987989635,81.18895793049658,3.453888254940008,7.239562482945138
5.0,25-2059.01,Adapted Physical Education Specialists,Y,https://www.onetonline.org/link/summary/25-2059.01,"$67,430 annual",Slower than average (1% to 2%),,"2,900",38% Bachelor’s degree | 33% Post-baccalaureate certificate,Bachelor's degree,38%,"Adapted Physical Education or Adapted Physical Activity Specialist, Adapted Physical Education Specialist, Adapted Physical Education Specialist-Workshop Leader, Adapted Physical Education Teacher, Certified Adapted Physical Educator, Physical Education Teacher","Provide individualized physical education instruction or services to children, youth, or adults with exceptional physical needs due to gross motor developmental delays or other impairments.",https://altpath.org/discover/nnpmf9c12zb1bpeg62b7doed,Physical Education Specialist,20.0,2.0,10.0,38.87944087657664,,91.0302311530802,3.1813272599148124,5.854781821713805
2.0,51-9191.00,Adhesive Bonding Machine Operators and Tenders,Y,https://www.onetonline.org/link/summary/51-9191.00,"$21.74 hourly, $45,210 annual",Slower than average (1% to 2%),1.0,"1,300",73% High school diploma or equivalent | 17% Post-secondary certificate,High school diploma or equivalent,73%,"Coater Operator, Glue Line Operator, Glue Reel Operator, Gluer Machine Operator, Gluing Pressman, Machine Operator, Perfect Bind Machine Operator, Process Assistant, Sealer Operator, Utility Worker","Operate or tend bonding machines that use adhesives to join items for further processing or to form a completed product. Processes include joining veneer sheets into plywood; gluing paper; or joining rubber and rubberized fabric parts, plastic, simulated leather, or other materials.",https://altpath.org/discover/uyws8dgzzkc2c7dy9s3mmgq8,Bonding Machine Operator,16.0,1.0,6.2,,,78.94736842105263,3.421052694320679,6.273684024810791
5.0,23-1021.00,"Administrative Law Judges, Adjudicators, and Hearing Officers",Y,https://www.onetonline.org/link/summary/23-1021.00,"$55.40 hourly, $115,230 annual",Decline (-1% or lower),-0.7,500,37% Doctoral degree | 20% Bachelor’s degree,Doctoral degree,37%,"Adjudicator, Administrative Hearing Officer, Administrative Judge, Administrative Law Judge, Appeals Examiner, Appeals Referee, Claims Adjudicator, Hearing Officer, Judge, Workers' Compensation Hearings Officer","Conduct hearings to recommend or make decisions on claims concerning government programs or other government-related matters. Determine liability, sanctions, or penalties, or recommend the acceptance or rejection of claims or settlements.",https://altpath.org/discover/h1ncpdqjhjs5vwte5scb92hu,Administrative Law Judge,14.0,3.0,21.4,42.11557567816408,29.409636515013897,67.11162668377894,3.098758854480832,12.260777656422317
3.0,11-3012.00,Administrative Services Managers,Y,https://www.onetonline.org/link/summary/11-3012.00,"$52.11 hourly, $108,390 annual",Faster than average (5% to 6%),4.6,"23,200",34% High school diploma or equivalent | 24% Bachelor’s degree,High school diploma or equivalent,34%,"Administrative Coordinator, Administrative Director, Administrative Manager, Administrative Officer, Administrator, Business Administrator, Business Manager","Plan, direct, or coordinate one or more administrative services of an organization, such as records and information management, mail distribution, and other office support services.",https://altpath.org/discover/ckbj80grkkvynylzjdj63007,Administrative Services Manager,18.0,1.0,5.6,,,,3.46666669845581,8.311828319758172
4.0,25-3011.00,"Adult Basic Education, Adult Secondary Education, and English as a Second Language Instructors",Y,https://www.onetonline.org/link/summary/25-3011.00,"$28.82 hourly, $59,950 annual",Decline (-1% or lower),-13.7,"3,900",41% Bachelor’s degree | 20% Master’s degree,Bachelor's degree,41%,"Adult Basic Education Instructor (ABE Instructor), Adult Basic Education Teacher (ABE Teacher), Adult Education Instructor, Adult Education Teacher, ESL Instructor (English as a Second Language Instructor), ESL Teacher (English as a Second Language Teacher), ESOL Teacher (English for Speakers of Other Languages Teacher), GED Instructor (General Educational Development Instructor), GED Teacher (General Educational Development Teacher), Teacher","Teach or instruct out-of-school youths and adults in remedial education classes, preparatory classes for the General Educational Development test, literacy, or English as a Second Language. Teaching may or may not take place in a traditional educational institution.",https://altpath.org/discover/w5nk7itlhuh7f41oo8j4qooc,Adult Education Instructor,37.0,19.0,51.4,40.26152309753295,46.925349295938645,78.51045865381894,3.383009513567023,10.507891257365973
5.0,29-1141.02,Advanced Practice Psychiatric Nurses,Y,https://www.onetonline.org/link/summary/29-1141.02,"$45.00 hourly, $93,600 annual",Faster than average (5% to 6%),,"189,100",87% Master’s degree | 9% Doctoral degree,Master's degree,87%,"Administrative Director, Behavioral Health Services, Adult Psychiatric Mental Health Nurse Practitioner, Advanced Practice Nurse Psychotherapist (APN Psychotherapist), Advanced Practice Psychiatric Nurse, Associate Chief Nurse, Associate Director of Nursing, Coordinator of the Psychiatric Liaison Service, Deputy Director of Clinical Specialty Services, Psychiatric Clinical Nurse Specialist, Psychiatric Mental Health Nurse (PMH Nurse)",Provide advanced nursing care for patients with psychiatric disorders. May provide psychotherapy under the direction of a psychiatrist.,https://altpath.org/discover/fccfd6k30n3ttcr9akzhbiew,Psychiatric Nurse,24.0,6.0,25.0,21.30038658568931,62.701828039392005,85.31712907165432,3.4597840245530347,7.491050692589953
4.0,11-2011.00,Advertising and Promotions Managers,Y,https://www.onetonline.org/link/summary/11-2011.00,"$61.04 hourly, $126,960 annual",Decline (-1% or lower),-2.2,"2,100",60% Bachelor’s degree | 10% High school diploma or equivalent,Bachelor's degree,60%,"Account Executive, Advertising Manager (Ad Manager), Advertising Sales Manager, Classified Advertising Manager, Communications Director, Communications Manager, Creative Services Director, Marketing and Promotions Manager, Promotions Director, Promotions Manager","Plan, direct, or coordinate advertising policies and programs or produce collateral materials, such as posters, contests, coupons, or give-aways, to create extra interest in the purchase of a product or service for a department, an entire organization, or on an account basis.",https://altpath.org/discover/jpw3mq0ggirk71qg1ietvssq,Advertising Manager,30.0,7.0,23.3,31.202255778826277,18.628269953116455,71.22318188785674,3.611805499020618,14.003297643656028
4.0,41-3011.00,Advertising Sales Agents,Y,https://www.onetonline.org/link/summary/41-3011.00,"$29.55 hourly, $61,460 annual",Decline (-1% or lower),-6.4,"9,300",52% Bachelor’s degree | 30% High school diploma or equivalent,Bachelor's degree,52%,"Account Manager, Accounts Executive, Accounts Manager, Advertising Account Executive, Advertising Account Representative, Advertising Consultant, Advertising Representative, Advertising Sales Representative, Marketing Consultant, Sales Representative","Sell or solicit advertising space, time, or media in publications, signage, TV, radio, or the Internet. Includes individuals who obtain leases for outdoor advertising sites or persuade retailers to use sales promotion display items.",https://altpath.org/discover/e6yf2mvy8zdq2c07ietg1zmy,Advertising Sales Agent,20.0,7.0,35.0,43.21582126806791,73.07692307692307,68.36489480970619,3.397036173947514,13.966717305399504
3.0,17-3021.00,Aerospace Engineering and Operations Technologists and Technicians,Y,https://www.onetonline.org/link/summary/17-3021.00,"$38.38 hourly, $79,830 annual",Much faster than average (7% or higher),8.1,900,39% Post-secondary certificate,Post-secondary certificate,39%,"Avionics Technician, Avionics Test Technician, Calibration Technician, Communication Technician, Electronics Technician, Engineering Technician, Instrumentation Technician, Spacecraft Systems Engineer, Systems Test Technician, Test Technician","Operate, install, calibrate, and maintain integrated computer/communications systems, consoles, simulators, and other data acquisition, test, and measurement instruments and equipment, which are used to launch, track, position, and evaluate air and space vehicles. May record and interpret test data.",https://altpath.org/discover/ico3vvx2ckbv7tbnyf0jdqxb,Aerospace Technician,11.0,0.0,0.0,,,,,
4.0,17-2011.00,Aerospace Engineers,Y,https://www.onetonline.org/link/summary/17-2011.00,"$64.82 hourly, $134,830 annual",Faster than average (5% to 6%),6.1,"4,500",59% Bachelor’s degree | 33% Master’s degree,Bachelor's degree,59%,"Aeronautical Engineer, Aerospace Engineer, Aerospace Stress Engineer, Avionics Engineer, Design Engineer, Flight Controls Engineer, Flight Test Engineer, Structural Analysis Engineer, Systems Engineer, Test Engineer","Perform engineering duties in designing, constructing, and testing aircraft, missiles, and spacecraft. May conduct basic and applied research to evaluate adaptability of materials and equipment to aircraft design and manufacture. May recommend improvements in testing equipment and techniques.",https://altpath.org/discover/z1oek6o70vysofn2fy178h2o,Aerospace Engineer,16.0,1.0,6.2,40.50632911392405,,70.25316455696202,3.2911391258239746,29.482550497599185
4.0,13-1011.00,"Agents and Business Managers of Artists, Performers, and Athletes",Y,https://www.onetonline.org/link/summary/13-1011.00,"$46.30 hourly, $96,310 annual",Much faster than average (7% or higher),8.7,"2,200",41% Bachelor’s degree | 38% High school diploma or equivalent,Bachelor's degree,41%,"Agent, Artist Agent, Artist Manager, Artist Representative, Athlete Marketing Agent, Booking Agent, Talent Agent, Talent Buyer, Talent Manager, Theatrical Agent","Represent and promote artists, performers, and athletes in dealings with current or prospective employers. May handle contract negotiation and other business matters for clients.",https://altpath.org/discover/ccasrs39xb5hnroueaoeso9o,Talent Agent or Business Manager,14.0,4.0,28.6,31.234709314854317,26.261162261403495,66.68967433482456,3.4374973566506344,15.17777806696533
4.0,17-2021.00,Agricultural Engineers,Y,https://www.onetonline.org/link/summary/17-2021.00,"$40.69 hourly, $84,630 annual",Faster than average (5% to 6%),5.9,100,75% Bachelor’s degree | 10% Master’s degree,Bachelor's degree,75%,"Agricultural Engineer, Agricultural Safety and Health Program Director, Agricultural Systems Specialist, Conservation Engineer, Engineer, Product Engineer, Product Technology Scientist, Project Engineer, Research Agricultural Engineer, Research Leader","Apply knowledge of engineering technology and biological science to agricultural problems concerned with power and machinery, electrification, structures, soil and water conservation, and processing of agricultural products.",https://altpath.org/discover/vewgromfdenf9jipp2ezu5ln,Agricultural Engineer,14.0,3.0,21.4,33.980582524271846,29.126213592233007,64.77227075278286,3.436596420668133,21.650579834234424
1.0,45-2091.00,Agricultural Equipment Operators,Y,https://www.onetonline.org/link/summary/45-2091.00,"$20.47 hourly, $42,580 annual",Much faster than average (7% or higher),7.7,"10,500",57% Less than high school diploma | 19% High school diploma or equivalent,Less than high school diploma,57%,"Baler Operator, Cutter Operator, Equipment Operator, Farm Hand, Farm Laborer, Hay Baler, Irrigation Worker, Rake Operator, Tractor Driver, Tractor Operator","Drive and control farm equipment to till soil and to plant, cultivate, and harvest crops. May perform tasks, such as crop baling or hay bucking. May operate stationary equipment to perform post-harvest tasks, such as husking, shelling, threshing, and ginning.",https://altpath.org/discover/u1ci9yjhxq1baniavmxbl1y5,Agricultural Equipment Operator,17.0,0.0,0.0,,,,,
2.0,45-2011.00,Agricultural Inspectors,Y,https://www.onetonline.org/link/summary/45-2011.00,"$24.51 hourly, $50,990 annual",Slower than average (1% to 2%),1.5,"2,200","56% High school diploma or equivalent | 12% Some college, no degree",High school diploma or equivalent,56%,"Brand Inspector, Consumer Safety Inspector (CSI), Deputy Brand Inspector, Food Inspector, Food Sanitarian, Grain Inspector, Inspector, Inspector, Food Safety and Inspection Service (Inspector, FSIS), Seed and Fertilizer Specialist, Shipping Point Inspector","Inspect agricultural commodities, processing equipment, and facilities, and fish and logging operations, to ensure compliance with regulations and laws governing health, quality, and safety.",https://altpath.org/discover/vzma8hw4jgurihp0250spwjx,Agricultural Inspector,16.0,2.0,12.5,,61.53846153846154,92.3076923076923,3.0713733539532955,11.255897547726576
5.0,25-1041.00,"Agricultural Sciences Teachers, Postsecondary",Y,https://www.onetonline.org/link/summary/25-1041.00,"$86,350 annual",Average (3% to 4%),4.1,800,55% Doctoral degree | 27% Post-doctoral training,Doctoral degree,55%,"Agriculture Instructor, Agriculture Professor, Animal Science Professor, Associate Professor, Extension Specialist, Horticulture Instructor, Horticulture Professor, Instructor, Plant Science Professor, Professor","Teach courses in the agricultural sciences. Includes teachers of agronomy, dairy sciences, fisheries management, horticultural sciences, poultry sciences, range management, and agricultural soil conservation. Includes both teachers primarily engaged in teaching and those who do a combination of teaching and research.",https://altpath.org/discover/qenfe826qdnyh590ijntuwaz,Postsecondary Agricultural Science Teacher,23.0,18.0,78.3,31.802997694607647,40.9949612258697,72.70354563498745,3.378563563247196,13.03176376222843
3.0,19-4012.00,Agricultural Technicians,Y,https://www.onetonline.org/link/summary/19-4012.00,"$22.49 hourly, $46,790 annual",Average (3% to 4%),4.3,"2,900",41% High school diploma or equivalent | 18% Bachelor’s degree,High school diploma or equivalent,41%,"Agricultural Research Technician (Agricultural Research Tech), Agricultural Research Technologist, Agricultural Technician (Agricultural Tech), Agriculture Assistant, Agronomy Research Technician (Agronomy Research Tech), Field Assistant, Insect Research Technician (Insect Research Tech), Lab Tech (Laboratory Technician), Seed Analyst","Work with agricultural scientists in plant, fiber, and animal research, or assist with animal breeding and nutrition. Set up or maintain laboratory equipment and collect samples from crops or animals. Prepare specimens or record data to assist scientists in biology or related life science experiments. Conduct tests and experiments to improve yield and quality of crops or to increase the resistance of plants and animals to disease or insects.",https://altpath.org/discover/uo447zgtkbfswikoiqt3l8cc,Agricultural Technician,26.0,4.0,15.4,43.37203310820236,26.495726495726498,69.51793632938289,3.27571960220068,12.974926774688528
,45-2099.00,"Agricultural Workers, All Other",,https://www.onetonline.org/link/summary/45-2099.00,"$19.42 hourly, $40,390 annual",Slower than average (1% to 2%),2.3,"1,500",,,,,All agricultural workers not listed separately.,https://altpath.org/discover/wb8tvqcm2kp5rua1wlpv479w,Agricultural Workers,,,,,,,,
,55-3011.00,Air Crew Members,,https://www.onetonline.org/link/summary/55-3011.00,,,,,,,,,"Perform in-flight duties to ensure the successful completion of combat, reconnaissance, transport, and search and rescue missions. Duties include operating aircraft communications and detection equipment, including establishing satellite linkages and jamming enemy communications capabilities; conducting pre-flight, in-flight, and post-flight inspections of onboard equipment; operating and maintaining aircraft weapons and defensive systems; operating and maintaining aircraft in-flight refueling systems; executing aircraft safety and emergency procedures; computing and verifying passenger, cargo, fuel, and emergency and special equipment weight and balance data; and conducting cargo and personnel drops.",,,,,,,,,,
,55-1011.00,Air Crew Officers,,https://www.onetonline.org/link/summary/55-1011.00,,,,,,,,,"Perform and direct in-flight duties to ensure the successful completion of combat, reconnaissance, transport, and search and rescue missions. Duties include operating aircraft communications and radar equipment, such as establishing satellite linkages and jamming enemy communications capabilities; operating aircraft weapons and defensive systems; conducting pre-flight, in-flight, and post-flight inspections of onboard equipment; and directing cargo and personnel drops.",,,,,,,,,,
3.0,53-2021.00,Air Traffic Controllers,Y,https://www.onetonline.org/link/summary/53-2021.00,"$69.51 hourly, $144,580 annual",Slower than average (1% to 2%),1.2,"2,200",36% High school diploma or equivalent | 21% Post-secondary certificate,High school diploma or equivalent,36%,"Air Traffic Control Specialist (ATCS), Air Traffic Control Specialist, Terminal, Air Traffic Control Specialist/Certified Professional Controller (ATC Specialist/CPC), Air Traffic Controller (ATC), Air Traffic Controller (Enroute Option), Air Traffic Controller (Tower Option), Air Traffic Controller, Center, Certified Professional Controller (CPC), Control Tower Operator, Radar Air Traffic Controller","Control air traffic on and within vicinity of airport and movement of air traffic between altitude sectors and control centers according to established procedures and policies. Authorize, regulate, and control commercial airline flights according to government or company regulations to expedite and ensure flight safety.",https://altpath.org/discover/atndd21mazd3xqj33bz9czd4,Air Traffic Controller,23.0,0.0,0.0,,,,,
2.0,53-1041.00,Aircraft Cargo Handling Supervisors,Y,https://www.onetonline.org/link/summary/53-1041.00,"$30.74 hourly, $63,940 annual",Faster than average (5% to 6%),5.2,"1,100",64% High school diploma or equivalent | 18% Bachelor’s degree,High school diploma or equivalent,64%,"Cargo Supervisor, Ground Operations Supervisor, Line Service Supervisor (LSS), Loadmaster, Ramp and Cargo Supervisor, Ramp Supervisor","Supervise and coordinate the activities of ground crew in the loading, unloading, securing, and staging of aircraft cargo or baggage. May determine the quantity and orientation of cargo and compute aircraft center of gravity. May accompany aircraft as member of flight crew and monitor and handle cargo in flight, and assist and brief passengers on safety and emergency procedures. Includes loadmasters.",https://altpath.org/discover/jydvg0en2shqz9ez7uaxekgi,Aircraft Cargo Supervisor,6.0,0.0,0.0,,,,,
,55-1012.00,Aircraft Launch and Recovery Officers,,https://www.onetonline.org/link/summary/55-1012.00,,,,,,,,,"Plan and direct the operation and maintenance of catapults, arresting gear, and associated mechanical, hydraulic, and control systems involved primarily in aircraft carrier takeoff and landing operations. Duties include supervision of readiness and safety of arresting gear, launching equipment, barricades, and visual landing aid systems; planning and coordinating the design, development, and testing of launch and recovery systems; preparing specifications for catapult and arresting gear installations; evaluating design proposals; determining handling equipment needed for new aircraft; preparing technical data and instructions for operation of landing aids; and training personnel in carrier takeoff and landing procedures.",,,,,,,,,,
,55-3012.00,Aircraft Launch and Recovery Specialists,,https://www.onetonline.org/link/summary/55-3012.00,,,,,,,,,"Operate and maintain catapults, arresting gear, and associated mechanical, hydraulic, and control systems involved primarily in aircraft carrier takeoff and landing operations. Duties include installing and maintaining visual landing aids; testing and maintaining launch and recovery equipment using electric and mechanical test equipment and hand tools; activating airfield arresting systems, such as crash barriers and cables, during emergency landing situations; directing aircraft launch and recovery operations using hand or light signals; and maintaining logs of airplane launches, recoveries, and equipment maintenance.",,,,,,,,,,
3.0,49-3011.00,Aircraft Mechanics and Service Technicians,Y,https://www.onetonline.org/link/summary/49-3011.00,"$37.83 hourly, $78,680 annual",Average (3% to 4%),4.0,"11,300",66% Post-secondary certificate | 15% Associate’s degree,Post-secondary certificate,66%,"Aircraft Maintenance Director, Aircraft Maintenance Supervisor, Aircraft Maintenance Technician (Aircraft Maintenance Tech), Aircraft Mechanic, Aircraft Restorer, Aircraft Technician, Airframe and Powerplant Mechanic (A and P Mechanic), Aviation Maintenance Technician (AMT), Aviation Mechanic, Helicopter Mechanic","Diagnose, adjust, repair, or overhaul aircraft engines and assemblies, such as hydraulic and pneumatic systems. Includes helicopter and aircraft engine specialists.",https://altpath.org/discover/jhahbv268hv13srilu6eq6fs,Aircraft Mechanic,38.0,0.0,0.0,,,,,
